id,first_name,last_name,email,gender,phone,country,address,postal_code,ip_address,date_format1,date_SQL_datetime,date_ISO8601_UTC,epoch,json_array,decimal_number,natural_number,latitude,longitude,currency,credict_card_number,price,description
a-943,Garnette,Frowd,gfrowdq6@dmoz.org,Female,765-210-0973,BR,67 Melrose Place,98700-000,24.220.123.240,10/27/2018,2018-11-11 18:51:28,2018-02-20T13:29:14Z,1537738415,[{}],551.5,66,-28.3833642,-53.929557,Real,3578237767616216,$4.42,lacus purus aliquet at feugiat non pretium quis lectus suspendisse potenti in eleifend quam a odio in hac habitasse platea
a-944,Myer,Esmond,mesmondq7@thetimes.co.uk,Male,619-273-7893,CN,9 Roth Hill,,251.249.25.85,08/16/2018,2018-08-30 05:15:46,2018-11-02T10:32:58Z,1538793480,"[{},{},{}]",144.69,29,28.532422,118.592707,Yuan Renminbi,5641828185019817936,$7.14,at vulputate vitae nisl aenean lectus pellentesque eget nunc donec quis
a-945,Ricardo,Neiland,rneilandq8@mozilla.com,Male,552-913-3684,IR,17979 Annamark Court,,185.185.80.129,07/31/2018,2017-12-30 00:26:39,2018-07-15T23:41:18Z,1520190799,"[{},{}]",681.43,64,29.2132568,52.6867529,Rial,3567399154468842,$9.61,volutpat eleifend donec ut dolor morbi vel lectus in quam fringilla rhoncus mauris enim leo rhoncus
a-946,Kiah,Foxton,kfoxtonq9@kickstarter.com,Female,714-379-6301,PL,83839 Morning Center,38-722,242.205.37.67,12/15/2017,2018-01-03 08:18:01,2018-07-25T11:44:19Z,1543459367,"[{},{},{}]",123.76,43,49.4715988,22.4496086,Zloty,3530925791207831,$5.96,at velit eu est congue elementum in hac habitasse platea dictumst morbi vestibulum velit id pretium iaculis
a-947,Montague,MacWilliam,mmacwilliamqa@hugedomains.com,Male,151-951-1994,BR,69 Linden Hill,62430-000,185.196.146.170,10/28/2018,2017-12-27 16:26:00,2018-11-11T20:21:21Z,1543433407,[{}],639.1,42,-3.2575968,-41.0394028,Real,5571543096667099,$2.49,suspendisse potenti cras in purus eu magna vulputate luctus cum sociis
a-948,Benson,Whetland,bwhetlandqb@phpbb.com,Male,469-226-1986,KP,83 Kenwood Junction,,110.183.53.56,07/25/2018,2018-01-19 10:36:20,2017-12-27T13:36:46Z,1530633352,"[{},{}]",541.22,46,38.67028,125.77611,Won,3529635161225106,$1.01,curae donec pharetra magna vestibulum aliquet ultrices erat tortor sollicitudin mi sit amet lobortis sapien sapien non mi
a-949,Thomasine,Camoys,tcamoysqc@msu.edu,Female,,SL,,,25.27.221.139,04/26/2018,2017-12-07 12:23:54,2018-10-23T18:45:54Z,1528195507,,,,,,,,,
a-950,Andros,Greendale,agreendaleqd@wunderground.com,Male,646-753-1717,PH,22596 Fulton Terrace,7413,96.40.190.64,12/16/2017,2018-06-03 23:53:32,2018-10-25T10:18:19Z,1536125184,"[{},{},{}]",341.37,7,29.8867761,-95.54919,Peso,3554288076864672,$6.80,semper porta volutpat quam pede lobortis ligula sit amet eleifend pede libero quis orci nullam molestie nibh in lectus pellentesque
a-951,Raff,Cresswell,rcresswellqe@jimdo.com,Male,655-327-9831,ID,326 Mifflin Junction,,155.28.151.134,08/04/2018,2018-08-21 01:55:25,2018-05-30T00:33:20Z,1540944403,"[{},{},{},{},{}]",363.13,63,-6.9353179,112.548349,Rupiah,3581059369163495,$4.98,etiam pretium iaculis justo in hac habitasse platea dictumst etiam faucibus cursus urna ut tellus nulla ut
a-952,Dewey,Deacock,ddeacockqf@msn.com,Male,555-726-6614,CN,8 Manley Point,,207.200.190.34,07/17/2018,2018-05-25 09:54:46,2018-12-01T04:33:58Z,1540663728,"[{},{},{}]",671.84,35,29.434465,110.345643,Yuan Renminbi,3556201400263071,$5.75,turpis donec posuere metus vitae ipsum aliquam non mauris morbi non lectus aliquam sit amet
a-953,Letti,Rothera,lrotheraqg@admin.ch,Female,391-253-8382,PH,2259 Del Sol Lane,2446,75.167.126.15,09/01/2018,2018-02-07 11:28:58,2018-05-15T21:37:39Z,1520210356,[{}],660.95,42,15.9946032,120.7916737,Peso,3582025052833925,$7.13,orci vehicula condimentum curabitur in libero ut massa volutpat convallis morbi odio odio elementum eu interdum
a-954,Bruce,Rodgers,brodgersqh@baidu.com,Male,900-127-3775,CN,554 Pankratz Crossing,,51.68.85.46,09/10/2018,2018-08-04 01:11:42,2018-08-29T22:27:21Z,1530145171,[{}],121.26,15,30.7016468,104.0663422,Yuan Renminbi,3529665531072912,$3.13,sollicitudin ut suscipit a feugiat et eros vestibulum ac est lacinia nisi venenatis tristique fusce congue diam id ornare
a-955,Yvon,McGeouch,ymcgeouchqi@yelp.com,Male,104-276-1892,UA,4422 Graceland Hill,,30.148.4.220,06/28/2018,2018-05-05 17:52:41,2018-02-19T10:02:58Z,1529277873,"[{},{}]",173.41,16,46.48684,32.97498,Hryvnia,5020912838890714,$2.27,aenean fermentum donec ut mauris eget massa tempor convallis nulla neque libero convallis eget eleifend luctus ultricies eu nibh quisque
a-956,Amelina,Gravenell,agravenellqj@earthlink.net,Female,292-142-8662,RU,79 Mcguire Parkway,303181,223.235.162.186,05/11/2018,2018-10-20 10:03:38,2018-10-25T01:44:21Z,1517515257,"[{},{},{}]",413.43,62,55.207388,34.2986255,Ruble,5100143870449366,$4.01,scelerisque mauris sit amet eros suspendisse accumsan tortor quis turpis
a-957,Nicoline,Klesel,nkleselqk@sina.com.cn,Female,956-787-6542,PL,72548 Hovde Court,58-588,142.7.93.53,11/28/2018,2018-02-27 06:36:13,2018-10-01T20:49:45Z,1517560010,[{}],40.79,34,50.3467983,16.8896987,Zloty,5007665656589449,$1.26,cubilia curae donec pharetra magna vestibulum aliquet ultrices erat tortor sollicitudin mi sit
a-958,Aubrie,Symcoxe,asymcoxeql@home.pl,Female,555-372-9185,BR,8 Helena Road,36680-000,141.44.200.22,11/19/2018,2018-01-04 03:16:36,2018-04-28T16:33:11Z,1535354712,"[{},{},{}]",152.46,39,-21.5367935,-43.0129853,Real,560221143247589439,$4.93,parturient montes nascetur ridiculus mus vivamus vestibulum sagittis sapien cum sociis natoque penatibus et magnis
a-959,Shanie,Niesing,sniesingqm@china.com.cn,Female,330-986-7557,PH,7252 Anzinger Way,2439,148.82.246.103,12/29/2017,2018-10-25 13:33:44,2018-05-25T11:30:24Z,1526628999,"[{},{},{}]",516.09,58,10.335192,123.3262483,Peso,3564130506034468,$1.08,duis aliquam convallis nunc proin at turpis a pede posuere nonummy integer non
a-960,Hamel,Tewnion,htewnionqn@census.gov,Male,640-236-1870,LK,3 Division Plaza,12500,37.94.76.207,10/10/2018,2018-05-24 02:59:03,2018-07-31T08:24:47Z,1529088645,[{}],723.48,27,6.7527994,79.8949309,Rupee,5487480167974257,$7.28,habitasse platea dictumst etiam faucibus cursus urna ut tellus nulla ut erat id mauris vulputate elementum nullam varius nulla
a-961,Caitrin,Relf,crelfqo@miibeian.gov.cn,Female,813-148-1953,PT,3 Commercial Park,7160-208,182.44.133.48,08/15/2018,2018-10-19 05:44:06,2018-07-22T08:58:02Z,1539674450,"[{},{}]",238.31,42,38.7754165,-7.41612,Euro,4041596318432150,$5.08,quam nec dui luctus rutrum nulla tellus in sagittis dui vel nisl duis ac nibh fusce lacus
a-962,Ali,Rickertsen,arickertsenqp@ox.ac.uk,Male,430-508-3371,RU,8558 Golf View Junction,624577,112.132.114.179,10/14/2018,2018-03-14 13:27:39,2018-03-28T16:47:18Z,1522997304,"[{},{},{},{},{}]",105.48,20,60.869764,60.437305,Ruble,5602259705402281984,$2.06,blandit non interdum in ante vestibulum ante ipsum primis in faucibus orci luctus et
a-963,Jeth,Ding,jdingqq@weebly.com,Male,302-333-1295,ID,1391 Oak Alley,,217.31.26.155,03/09/2018,2018-03-04 01:02:14,2017-12-17T02:35:36Z,1525339781,"[{},{},{}]",185.24,58,-0.2467982,109.6163185,Rupiah,6334942857408378,$6.49,lobortis sapien sapien non mi integer ac neque duis bibendum morbi non quam nec dui luctus
a-964,Lynett,Faire,lfaireqr@seesaa.net,Female,276-346-7464,CN,09609 John Wall Crossing,,48.15.175.210,01/30/2018,2018-06-22 05:14:44,2018-08-15T01:34:56Z,1542849910,[{}],675.12,11,26.022703,119.602109,Yuan Renminbi,5602243206782333,$8.06,faucibus orci luctus et ultrices posuere cubilia curae nulla dapibus dolor vel est donec odio justo sollicitudin ut
a-965,Dalton,Lyver,dlyverqs@fc2.com,Male,483-176-0662,PL,73 Columbus Alley,33-111,44.122.12.212,09/23/2018,2018-10-15 17:17:45,2018-06-08T01:44:55Z,1532404205,"[{},{},{},{},{}]",730.39,11,49.9776657,20.9421091,Zloty,3568373176231230,$0.48,donec diam neque vestibulum eget vulputate ut ultrices vel augue vestibulum ante ipsum primis in faucibus orci luctus et
a-966,Cassie,Kidder,ckidderqt@dropbox.com,Female,494-483-2795,MM,33926 Sunfield Alley,,44.7.94.112,05/14/2018,2018-07-01 04:55:25,2018-06-07T03:39:58Z,1517065083,"[{},{}]",578.71,33,18.4931618,95.5066242,Kyat,3581417322795029,$8.84,eros vestibulum ac est lacinia nisi venenatis tristique fusce congue diam id ornare imperdiet sapien urna
a-967,Conn,Wilcock,cwilcockqu@forbes.com,Male,478-375-1974,ID,78 Straubel Crossing,,189.178.84.189,06/03/2018,2018-11-20 16:44:53,2018-10-15T22:57:47Z,1521306487,"[{},{},{}]",658.68,66,-6.1661827,105.8527907,Rupiah,3559506797671885,$8.89,magna at nunc commodo placerat praesent blandit nam nulla integer pede justo lacinia
a-968,Moshe,Devenish,mdevenishqv@craigslist.org,Male,,BR,,,177.247.94.164,04/05/2018,2018-09-19 20:32:15,2018-11-19T21:00:18Z,1527071733,,,,,,,,,
a-969,Brody,Marlon,bmarlonqw@example.com,Male,246-591-4689,CN,10556 Declaration Street,,38.117.26.132,03/30/2018,2018-11-01 20:19:20,2018-11-28T10:00:39Z,1539582148,"[{},{},{},{}]",423.04,29,40.71104,120.83694,Yuan Renminbi,3574665914854443,$2.93,eu felis fusce posuere felis sed lacus morbi sem mauris laoreet ut rhoncus aliquet pulvinar sed nisl
a-970,Jerrie,Howis,jhowisqx@springer.com,Male,574-458-2257,UA,06213 Alpine Center,,136.95.200.60,04/08/2018,2017-12-24 05:07:53,2018-06-23T12:40:30Z,1526187314,"[{},{},{},{},{}]",768.59,29,48.5006149,34.6523446,Hryvnia,4041373073903837,$5.00,consequat varius integer ac leo pellentesque ultrices mattis odio donec vitae nisi nam ultrices libero non mattis pulvinar
a-971,Colet,Attaway,cattawayqy@theglobeandmail.com,Male,533-193-7452,SY,2 Coleman Place,,118.138.73.1,08/17/2018,2018-05-02 13:54:21,2018-04-27T08:54:07Z,1519402329,"[{},{},{},{}]",529.05,16,36.1181827,36.5162077,Pound,3546717803664642,$7.32,eu massa donec dapibus duis at velit eu est congue elementum in hac habitasse platea dictumst morbi vestibulum velit
a-972,Fonsie,Knibb,fknibbqz@nbcnews.com,Male,922-658-3923,SE,8 Gale Alley,151 88,22.32.208.229,09/08/2018,2018-03-04 08:31:22,2018-04-16T17:32:26Z,1527423830,"[{},{},{},{}]",59.11,25,59.1815399,17.5858441,Krona,3528995720943008,$4.21,nunc purus phasellus in felis donec semper sapien a libero nam dui proin leo odio porttitor id
a-973,Andra,Standidge,astandidger0@mapy.cz,Female,574-289-0235,CD,02395 Heffernan Drive,,232.237.106.128,02/02/2018,2018-11-19 22:56:04,2018-06-30T06:06:57Z,1523028931,"[{},{}]",289.27,17,2.1701072,21.4872092,Franc,3549722768681042,$7.11,fringilla rhoncus mauris enim leo rhoncus sed vestibulum sit amet cursus id turpis integer aliquet massa id
a-974,Julian,Krolak,jkrolakr1@time.com,Male,839-551-4536,ID,430 Manitowish Way,,217.141.194.48,02/16/2018,2018-01-26 10:43:52,2018-03-09T03:52:13Z,1521975211,"[{},{},{},{},{}]",547.82,77,-6.8063294,107.6363296,Rupiah,3588140647131448,$4.35,ipsum ac tellus semper interdum mauris ullamcorper purus sit amet nulla quisque arcu libero rutrum ac lobortis vel dapibus at
a-975,Kimmi,Inman,kinmanr2@reuters.com,Female,291-663-9919,ID,7 Bashford Alley,,70.93.59.135,02/10/2018,2018-03-10 23:41:55,2018-11-08T21:36:27Z,1522037617,"[{},{},{}]",596.85,40,-8.1067604,111.8240676,Rupiah,3534892754948627,$8.79,sapien dignissim vestibulum vestibulum ante ipsum primis in faucibus orci
a-976,Alair,Gonthard,agonthardr3@newsvine.com,Male,683-426-5058,SE,96 Sunfield Street,111 46,31.56.171.91,05/05/2018,2017-12-18 10:16:10,2018-06-23T13:45:59Z,1536032905,"[{},{},{},{},{}]",548.97,66,59.3337467,18.0732103,Krona,58933490192402959,$6.07,dolor sit amet consectetuer adipiscing elit proin risus praesent lectus vestibulum quam sapien
a-977,Sergio,Heliet,shelietr4@vinaora.com,Male,239-551-3083,CA,11555 Lotheville Point,V1A,21.153.194.93,05/14/2018,2018-09-28 01:06:10,2017-12-10T12:26:03Z,1515625998,[{}],23.03,17,49.6885534,-115.9220734,Dollar,6762792643405480,$0.24,tristique in tempus sit amet sem fusce consequat nulla nisl nunc nisl duis
a-978,Alida,Fitchett,afitchettr5@geocities.com,Female,128-570-3069,ID,619 Westerfield Parkway,,7.47.240.141,05/25/2018,2018-07-03 16:26:45,2018-10-11T23:22:33Z,1539609626,"[{},{},{},{}]",399.86,21,-8.3408114,123.6231723,Rupiah,5576376081514058,$2.63,morbi a ipsum integer a nibh in quis justo maecenas rhoncus aliquam lacus morbi quis
a-979,Chickie,Penvarne,cpenvarner6@quantcast.com,Male,830-901-1263,ID,7 Garrison Trail,,64.126.134.250,07/24/2018,2018-04-10 09:05:33,2018-10-23T23:16:14Z,1536778822,"[{},{},{},{},{}]",716.24,23,-6.2002533,106.8221628,Rupiah,6394811336008884,$9.43,parturient montes nascetur ridiculus mus vivamus vestibulum sagittis sapien cum sociis natoque penatibus et magnis dis parturient montes nascetur ridiculus
a-980,Marvin,Lebang,mlebangr7@whitehouse.gov,Male,789-143-6509,CN,37988 Portage Parkway,,246.253.33.119,06/14/2018,2018-03-15 15:52:55,2018-08-25T22:06:50Z,1520715482,[{}],500.93,48,29.1416432,119.7889248,Yuan Renminbi,6759683655124025,$1.43,id justo sit amet sapien dignissim vestibulum vestibulum ante ipsum primis in faucibus orci luctus
a-981,Aleta,Dimelow,adimelowr8@harvard.edu,Female,,BR,,,220.218.38.123,08/23/2018,2018-10-16 19:25:44,2018-03-31T09:58:48Z,1526296305,,,,,,,,,
a-982,Zena,Impett,zimpettr9@house.gov,Female,289-283-4516,BR,3148 Bellgrove Center,45710-000,116.109.31.66,07/15/2018,2018-09-09 15:15:17,2018-02-01T03:54:23Z,1516842598,"[{},{}]",201.59,70,-15.118465,-40.0660682,Real,5602255663012707,$0.88,sit amet lobortis sapien sapien non mi integer ac neque duis bibendum morbi
a-983,Gannon,Shovell,gshovellra@sciencedaily.com,Male,419-591-8361,FR,8 Old Gate Alley,06116 CEDEX,65.60.232.27,01/08/2018,2017-12-11 05:03:13,2018-05-21T17:51:09Z,1538537235,"[{},{},{},{},{}]",156.52,73,43.5634394,6.9658358,Euro,201836071960839,$5.92,metus vitae ipsum aliquam non mauris morbi non lectus aliquam sit amet diam in magna bibendum imperdiet nullam
a-984,Vyky,Iddins,viddinsrb@meetup.com,Female,,PH,,,2.29.237.108,01/01/2018,2018-09-20 13:50:50,2018-04-18T18:22:30Z,1543685026,,,,,,,,,
a-985,Dru,Copner,dcopnerrc@nytimes.com,Female,,CO,,,103.220.7.89,01/01/2018,2017-12-08 22:21:48,2018-07-01T21:41:51Z,1533216221,,,,,,,,,
a-986,Murvyn,Brinded,mbrindedrd@huffingtonpost.com,Male,888-217-8107,CZ,80 Eagle Crest Center,588 22,114.121.166.112,10/02/2018,2018-11-11 07:43:30,2018-04-12T12:51:25Z,1536681598,"[{},{}]",568.1,67,49.374032,15.7019393,Koruna,3568618134001541,$0.07,accumsan odio curabitur convallis duis consequat dui nec nisi volutpat eleifend donec ut dolor morbi vel
a-987,Brooks,Gorges,bgorgesre@bravesites.com,Female,826-328-6002,TJ,55 Wayridge Center,,166.25.201.42,09/10/2018,2018-02-26 12:04:44,2018-01-01T10:28:15Z,1531668112,"[{},{}]",458.61,60,40.31628,69.73743,Somoni,4405723827621137,$8.46,pede morbi porttitor lorem id ligula suspendisse ornare consequat lectus in est risus auctor sed
a-988,Link,Roxburch,lroxburchrf@sphinn.com,Male,998-708-8290,CN,5 Briar Crest Terrace,,178.77.209.168,10/05/2018,2018-11-05 05:08:41,2018-09-20T04:03:45Z,1535503221,"[{},{}]",205.02,11,29.696195,106.79542,Yuan Renminbi,3562325738646061,$4.32,blandit mi in porttitor pede justo eu massa donec dapibus duis at velit eu est
a-989,Mendel,Forrestall,mforrestallrg@wikipedia.org,Male,504-198-0718,SE,63859 Melby Point,121 48,211.223.187.244,09/18/2018,2017-12-28 02:37:56,2018-05-17T09:06:37Z,1514978229,"[{},{},{},{},{}]",649.92,69,59.2933395,18.0994673,Krona,3552542909918184,$1.44,massa quis augue luctus tincidunt nulla mollis molestie lorem quisque ut erat curabitur gravida nisi at nibh
a-990,Arman,Barthel,abarthelrh@cbc.ca,Male,118-541-9422,PL,593 Nevada Pass,59-601,168.16.127.157,09/28/2018,2018-03-29 06:19:44,2018-10-27T00:56:34Z,1519742290,"[{},{}]",678.49,7,51.1081572,15.583895,Zloty,5281208578390021,$3.09,porttitor pede justo eu massa donec dapibus duis at velit eu est congue elementum in hac habitasse
a-991,Tremain,MacLeese,tmacleeseri@xrea.com,Male,833-629-4867,CN,13 Welch Way,,201.102.148.189,02/12/2018,2018-11-02 12:01:47,2018-05-24T02:41:31Z,1531976007,"[{},{}]",436.68,38,29.3781872,121.9194335,Yuan Renminbi,6370592222570132,$1.98,donec semper sapien a libero nam dui proin leo odio porttitor id consequat in consequat ut nulla
a-992,Tracy,MacRierie,tmacrierierj@devhub.com,Female,259-980-2795,PH,66423 Meadow Vale Way,7109,169.251.217.143,04/05/2018,2018-08-26 19:39:00,2018-02-28T08:28:12Z,1513760494,"[{},{},{},{},{}]",637.04,29,8.5123871,123.2843256,Peso,6304035264129594769,$6.28,quis orci eget orci vehicula condimentum curabitur in libero ut massa volutpat convallis
a-993,Alonzo,Tapply,atapplyrk@blogger.com,Male,306-566-9025,UA,39925 Sundown Center,,110.35.184.100,01/30/2018,2018-06-30 16:50:40,2018-08-18T03:08:39Z,1541091219,[{}],46.73,29,49.9484387,23.5302946,Hryvnia,5002354386456550,$8.89,turpis sed ante vivamus tortor duis mattis egestas metus aenean
a-994,Vince,Waight,vwaightrl@statcounter.com,Male,503-851-6445,BR,95 Twin Pines Parkway,42800-000,113.129.40.199,06/03/2018,2018-06-21 12:00:08,2017-12-17T17:58:54Z,1540154603,"[{},{}]",205.47,62,-12.7073296,-38.3231594,Real,340964223676798,$3.23,odio odio elementum eu interdum eu tincidunt in leo maecenas pulvinar lobortis
a-995,Rea,Berzons,rberzonsrm@tinyurl.com,Female,704-593-9068,PH,39 Grim Park,6513,188.97.39.0,08/25/2018,2018-05-05 03:24:47,2018-05-19T08:55:56Z,1535701005,"[{},{}]",371.58,20,11.1856085,124.9202302,Peso,3578283087455497,$0.65,rhoncus sed vestibulum sit amet cursus id turpis integer aliquet massa id lobortis convallis tortor risus dapibus augue vel accumsan
a-996,Dreddy,Worssam,dworssamrn@fastcompany.com,Female,126-183-8038,FR,4 Rockefeller Point,44265 CEDEX 2,127.201.110.99,03/09/2018,2018-06-07 12:54:04,2018-02-03T12:05:30Z,1537381507,"[{},{},{},{},{}]",81.23,6,47.2550409,-1.5401497,Euro,5602211482841024,$8.47,diam id ornare imperdiet sapien urna pretium nisl ut volutpat sapien arcu sed augue aliquam erat volutpat in congue
a-997,Christa,Botham,cbothamro@barnesandnoble.com,Female,271-261-4528,AL,270 Lighthouse Bay Trail,,102.177.178.153,11/14/2018,2017-12-24 15:44:13,2018-11-06T05:53:49Z,1539402640,"[{},{},{},{}]",325.12,68,40.9942545,20.0181673,Lek,30527361069392,$2.89,ut volutpat sapien arcu sed augue aliquam erat volutpat in congue etiam justo etiam pretium
a-998,Hal,Plumbe,hplumberp@engadget.com,Male,928-149-0496,HR,61 Kennedy Court,32251,23.227.3.204,09/01/2018,2018-02-01 09:06:10,2018-07-27T09:17:53Z,1515597989,[{}],415.76,2,45.1839187,18.8237103,Kuna,337941172198540,$3.68,sapien iaculis congue vivamus metus arcu adipiscing molestie hendrerit at
a-999,Lucille,Cogle,lcoglerq@seattletimes.com,Female,739-706-2938,CZ,3719 Anhalt Road,687 07,193.77.82.166,06/15/2018,2017-12-28 02:34:05,2018-01-19T17:08:05Z,1542236663,"[{},{}]",216.85,16,49.0936632,17.3725325,Koruna,5610255204048012,$4.39,in libero ut massa volutpat convallis morbi odio odio elementum eu interdum eu tincidunt in leo maecenas pulvinar
a-1000,Zebedee,Ragborne,zragbornerr@google.es,Male,544-851-1056,MY,114 Algoma Drive,01540,252.35.73.225,12/12/2017,2018-02-09 20:31:07,2018-07-15T05:27:48Z,1525368507,"[{},{},{}]",664.39,14,6.4387946,100.1947477,Ringgit,4026699944519,$5.97,aliquet maecenas leo odio condimentum id luctus nec molestie sed justo pellentesque viverra pede
b-1,Rocky,Aucourte,raucourte0@google.ru,Male,360-877-0918,PT,685 Emmet Place,4815-668,165.158.147.170,11/07/2018,2018-09-03 11:40:17,2018-11-24T12:41:30Z,1519441995,"[{},{},{}]",502.64,14,41.3620123,-8.2829824,Euro,56022490543784572,$6.75,faucibus orci luctus et ultrices posuere cubilia curae mauris viverra diam vitae quam suspendisse potenti nullam
b-2,Geoffrey,Eefting,geefting1@shareasale.com,Male,295-479-6604,PT,4618 Clyde Gallagher Point,3525-606,166.196.209.103,04/10/2018,2018-06-03 04:30:25,2018-04-06T18:45:22Z,1528922867,"[{},{},{}]",36.02,68,40.4709245,-7.9185148,Euro,3552604060421372,$3.74,cras in purus eu magna vulputate luctus cum sociis natoque penatibus
b-3,Siouxie,Stitle,sstitle2@bing.com,Female,525-407-2228,CN,352 Loomis Circle,,0.159.134.62,05/30/2018,2018-09-28 15:50:17,2018-11-04T15:59:17Z,1518113429,[{}],710.33,50,37.054157,122.354016,Yuan Renminbi,6376715793935806,$1.43,viverra eget congue eget semper rutrum nulla nunc purus phasellus in
b-4,Albie,De la Yglesia,adelayglesia3@ameblo.jp,Male,299-706-2742,RS,62 Hallows Drive,,141.213.52.205,11/13/2018,2018-09-18 11:53:32,2018-04-20T17:54:20Z,1529288701,"[{},{},{},{},{}]",748.17,3,44.8158674,20.4734419,Dinar,3551886269834254,$7.57,nisl nunc nisl duis bibendum felis sed interdum venenatis turpis enim
b-5,Ole,Gwynn,ogwynn4@opera.com,Male,442-569-4075,BR,10314 Twin Pines Point,37950-000,211.85.133.131,10/18/2018,2018-11-06 22:51:52,2018-10-29T17:22:42Z,1532357600,"[{},{}]",649.38,25,-20.9052746,-46.995789,Real,4911443958290969,$0.78,ut tellus nulla ut erat id mauris vulputate elementum nullam varius nulla facilisi cras non velit nec nisi vulputate nonummy
b-6,Stanford,Rootham,srootham5@flickr.com,Male,330-958-4311,FR,313 Packers Avenue,91304 CEDEX,134.237.101.243,08/03/2018,2018-06-08 02:36:24,2018-08-09T19:13:08Z,1538855052,[{}],575.11,59,48.732568,2.2889821,Euro,337941264424440,$3.61,in blandit ultrices enim lorem ipsum dolor sit amet consectetuer adipiscing elit proin interdum mauris non ligula pellentesque
b-7,Rhys,O'Glessane,roglessane6@goo.gl,Male,272-937-6349,DM,4331 Roxbury Way,,109.45.81.12,10/29/2018,2018-07-26 10:45:38,2018-10-26T16:43:53Z,1539544082,"[{},{},{},{}]",91.52,25,15.444313,-61.444406,Dollar,5108750534125950,$0.77,ipsum primis in faucibus orci luctus et ultrices posuere cubilia curae duis faucibus accumsan odio curabitur convallis
b-8,Marybelle,Goldberg,mgoldberg7@shutterfly.com,Female,751-957-4519,ID,7913 Gerald Lane,,149.113.218.228,07/26/2018,2018-07-13 13:57:53,2018-09-15T00:26:15Z,1544025958,[{}],305.39,39,-7.5691667,107.9047222,Rupiah,3535587344383520,$4.75,duis faucibus accumsan odio curabitur convallis duis consequat dui nec nisi volutpat eleifend donec ut dolor morbi vel lectus in
b-9,Wendye,Giamo,wgiamo8@symantec.com,Female,758-317-8674,PL,136 Monument Crossing,42-294,232.247.25.157,10/11/2018,2018-11-07 07:57:10,2018-09-08T08:28:11Z,1536783111,"[{},{},{},{}]",721.8,29,50.8667699,18.828601,Zloty,3574703806926563,$1.23,est phasellus sit amet erat nulla tempus vivamus in felis eu
b-10,Olia,Vairow,ovairow9@elpais.com,Female,650-319-6738,NZ,67680 Artisan Place,7745,218.198.215.202,08/29/2018,2018-05-03 02:31:04,2018-07-24T17:51:48Z,1533378523,"[{},{},{}]",62.99,53,-43.6337764,171.6468521,Dollar,490393497184103360,$4.19,at dolor quis odio consequat varius integer ac leo pellentesque ultrices mattis odio donec vitae nisi nam ultrices
b-11,Konstantin,Ludl,kludla@springer.com,Male,148-903-2014,CA,47900 Namekagon Place,K2J,71.119.238.57,04/26/2018,2018-11-11 15:36:41,2018-12-01T05:30:55Z,1541843884,"[{},{},{},{}]",42.87,43,45.346466,-75.807881,Dollar,6761520002915196370,$0.32,quis orci eget orci vehicula condimentum curabitur in libero ut massa volutpat convallis morbi odio odio elementum eu interdum
b-12,Clotilda,Shelf,cshelfb@cnet.com,Female,864-533-7457,PH,2 Sugar Drive,1472,6.72.180.44,03/08/2018,2018-03-01 18:26:03,2018-04-28T14:38:35Z,1540681228,"[{},{},{},{}]",73.25,70,14.657554,120.960724,Peso,3549893990017022,$8.93,hac habitasse platea dictumst etiam faucibus cursus urna ut tellus nulla ut
b-13,Desmund,Medforth,dmedforthc@soundcloud.com,Male,621-375-4944,VN,7946 Sycamore Pass,,36.96.166.139,04/07/2018,2017-12-27 23:45:31,2018-08-09T09:37:53Z,1532118201,[{}],36.83,3,14.0134002,109.0547476,Dong,3531692514112420,$3.55,id lobortis convallis tortor risus dapibus augue vel accumsan tellus
b-14,Lorena,Ixer,lixerd@archive.org,Female,183-348-3805,PL,33 Crest Line Point,87-140,110.27.188.119,12/25/2017,2018-03-25 18:12:24,2017-12-12T08:13:16Z,1520444384,"[{},{},{}]",631.43,20,53.1844724,18.6045572,Zloty,56022514118838917,$7.30,quis orci nullam molestie nibh in lectus pellentesque at nulla suspendisse potenti cras in purus eu
b-15,Whitby,Portail,wportaile@networksolutions.com,Male,344-427-9687,FR,90 Stang Circle,42304 CEDEX,37.144.120.236,08/02/2018,2018-11-28 20:40:36,2018-03-30T01:20:52Z,1517392853,"[{},{},{}]",684.1,7,45.161017,1.663862,Euro,30109519301918,$8.62,vestibulum aliquet ultrices erat tortor sollicitudin mi sit amet lobortis sapien sapien non mi integer
b-16,Hewett,Cutress,hcutressf@ifeng.com,Male,961-712-5266,CN,775 Village Trail,,124.3.73.187,11/01/2018,2018-10-05 09:04:28,2018-07-31T05:44:36Z,1541135421,"[{},{}]",360.43,46,25.8749206,116.0386902,Yuan Renminbi,4017955318304662,$7.12,elit proin risus praesent lectus vestibulum quam sapien varius ut blandit non interdum in ante vestibulum
b-17,Jere,Tudge,jtudgeg@ftc.gov,Female,883-409-5314,PH,25 Hovde Alley,8405,110.157.61.199,08/09/2018,2018-05-21 02:23:33,2018-04-21T23:21:24Z,1528953856,"[{},{},{}]",545.82,2,9.6470386,125.602355,Peso,3548786417152102,$8.58,venenatis tristique fusce congue diam id ornare imperdiet sapien urna pretium nisl
b-18,Lou,Skerritt,lskerritth@ucoz.com,Male,612-141-0498,PS,12334 Orin Park,,155.173.158.32,05/15/2018,2018-10-14 07:24:23,2018-08-14T00:43:25Z,1540127854,"[{},{},{}]",613.83,77,31.945399,35.072502,Shekel,3537948929965636,$1.49,quis turpis eget elit sodales scelerisque mauris sit amet eros suspendisse accumsan tortor quis turpis sed ante
b-19,Luise,Pawelec,lpaweleci@salon.com,Female,239-465-6362,HN,5 Division Point,,191.203.231.121,04/28/2018,2018-02-22 22:45:58,2017-12-07T23:05:02Z,1531610569,"[{},{},{},{}]",673.75,63,14.1899344,-87.3314264,Lempira,67627123940971023,$3.56,natoque penatibus et magnis dis parturient montes nascetur ridiculus mus etiam vel augue vestibulum rutrum
b-20,Gabie,Beldum,gbeldumj@time.com,Female,357-965-4218,AR,8 Buell Center,3514,84.109.245.137,10/31/2018,2018-07-27 05:38:26,2018-05-30T07:32:13Z,1527752188,"[{},{}]",537.09,17,-27.4887196,-58.9495941,Peso,5002350389370905,$5.62,urna pretium nisl ut volutpat sapien arcu sed augue aliquam erat volutpat in congue etiam
