id,first_name,last_name,email,gender,phone,country,address,postal_code,ip_address,date_format1,date_SQL_datetime,date_ISO8601_UTC,epoch,json_array,decimal_number,natural_number,latitude,longitude,currency,credict_card_number,price,description
b-495,Cheslie,Hauck,chauckdq@blog.com,Female,325-904-8200,PH,4 Pennsylvania Court,6711,29.29.124.254,10/09/2018,2018-03-03 04:53:01,2018-05-22T17:20:08Z,1526964096,"[{},{}]",29.44,63,14.3839328,121.050126,Peso,3588319895723318,$2.45,nulla pede ullamcorper augue a suscipit nulla elit ac nulla sed vel enim sit amet
b-496,Bobbe,Bunney,bbunneydr@google.co.jp,Female,552-949-2416,GB,537 Alpine Road,CH48,204.235.214.19,09/04/2018,2018-06-06 19:51:08,2018-09-02T06:26:22Z,1538052084,"[{},{}]",648.17,45,53.3758568,-3.1605843,Pound,5602216417956540,$3.15,tellus nisi eu orci mauris lacinia sapien quis libero nullam sit amet turpis elementum ligula vehicula
b-497,Goran,Schwier,gschwierds@mail.ru,Male,179-385-6746,FR,2350 Holmberg Way,78415 CEDEX,253.103.85.175,07/31/2018,2018-01-14 23:03:29,2018-06-22T10:08:33Z,1542462467,[{}],710.49,30,48.958607,1.845782,Euro,6709485777797558191,$10.00,ultrices phasellus id sapien in sapien iaculis congue vivamus metus arcu adipiscing molestie hendrerit at vulputate vitae nisl aenean lectus
b-498,Jon,Bratt,jbrattdt@stanford.edu,Male,265-190-7173,CN,7 Dayton Trail,,31.197.12.168,05/27/2018,2018-12-03 01:59:30,2018-01-18T05:03:33Z,1529105204,[{}],1.02,75,3.14405,101.69676,Yuan Renminbi,3570275347855563,$9.43,vel augue vestibulum ante ipsum primis in faucibus orci luctus et
b-499,Melli,Rizzardini,mrizzardinidu@ehow.com,Female,152-389-2589,CN,0671 Miller Place,,45.19.245.122,01/18/2018,2018-01-03 06:57:50,2018-10-12T06:59:25Z,1536893047,"[{},{},{}]",430.19,41,26.394403,111.314117,Yuan Renminbi,3549039278159595,$9.16,pede ullamcorper augue a suscipit nulla elit ac nulla sed vel enim sit amet nunc viverra dapibus
b-500,Arte,Pyvis,apyvisdv@irs.gov,Male,632-472-5893,AS,14 Summer Ridge Parkway,96799,55.224.122.117,12/10/2017,2018-04-02 00:18:58,2018-11-28T16:40:12Z,1520246364,"[{},{},{},{}]",716.88,12,-14.2697392,-170.6618234,Dollar,3567377241163212,$1.85,mollis molestie lorem quisque ut erat curabitur gravida nisi at
b-501,Yule,Shead,ysheaddw@bing.com,Male,227-887-9254,KH,53402 Utah Pass,,182.186.184.192,04/08/2018,2018-07-06 16:49:10,2018-10-12T13:39:01Z,1519823471,"[{},{}]",391.61,4,11.142722,105.8290298,Riels,6771746187712288,$5.81,mauris vulputate elementum nullam varius nulla facilisi cras non velit nec nisi
b-502,Ximenez,Rapport,xrapportdx@yolasite.com,Male,446-915-6923,CN,7 Prairieview Avenue,,148.81.50.205,02/02/2018,2018-02-04 08:29:20,2018-07-07T02:51:01Z,1534822329,"[{},{}]",430.9,20,23.096432,113.334825,Yuan Renminbi,5602228877998805,$7.15,ut tellus nulla ut erat id mauris vulputate elementum nullam varius nulla facilisi cras non velit
b-503,Evita,Chominski,echominskidy@sakura.ne.jp,Female,561-295-5223,US,7 Moland Pass,33499,76.239.84.209,08/27/2018,2018-05-10 12:02:42,2018-08-05T06:31:22Z,1525351156,"[{},{}]",470.78,16,26.4068381,-80.1058665,Dollar,374288850661165,$1.81,sed lacus morbi sem mauris laoreet ut rhoncus aliquet pulvinar sed nisl nunc rhoncus dui
b-504,Erasmus,Aldcorne,ealdcornedz@storify.com,Male,865-248-1189,CN,1353 Walton Avenue,,23.181.212.195,09/11/2018,2018-05-08 01:21:08,2018-07-13T17:51:06Z,1532614356,"[{},{},{},{},{}]",668.15,69,39.025627,116.975436,Yuan Renminbi,4844273067902705,$8.81,diam vitae quam suspendisse potenti nullam porttitor lacus at turpis donec posuere metus vitae ipsum aliquam non mauris morbi
b-505,Tatum,A'Barrow,tabarrowe0@apple.com,Female,765-664-7194,TL,870 Maple Wood Alley,,234.12.27.146,10/04/2018,2018-08-01 08:46:16,2018-11-05T12:16:32Z,1515742296,"[{},{},{},{},{}]",437.99,39,-8.613782,125.2052299,Dollar,5293167884478738,$3.72,eget massa tempor convallis nulla neque libero convallis eget eleifend luctus ultricies eu nibh
b-506,Walsh,Ibell,wibelle1@ucsd.edu,Male,122-529-4909,NG,4 Mcbride Plaza,,165.47.33.59,11/07/2018,2018-10-20 05:05:20,2018-05-25T13:19:31Z,1527898360,[{}],125.04,14,6.7001345,7.3246534,Naira,3546604167324874,$2.09,dui vel sem sed sagittis nam congue risus semper porta volutpat quam
b-507,Collette,Ridgewell,cridgewelle2@networksolutions.com,Female,199-110-4324,ID,99087 Gerald Avenue,,14.187.141.129,02/03/2018,2018-10-22 11:50:03,2018-06-29T15:22:11Z,1524051028,"[{},{},{}]",682.44,71,-6.86277,109.6222698,Rupiah,374622067315324,$9.27,ipsum praesent blandit lacinia erat vestibulum sed magna at nunc commodo placerat praesent blandit
b-508,Jimmie,Blanc,jblance3@woothemes.com,Male,817-614-4995,CN,3 Upham Point,,70.8.92.34,05/22/2018,2018-07-03 19:37:48,2018-07-16T06:56:47Z,1523190385,"[{},{}]",743.54,44,31.947633,108.664214,Yuan Renminbi,676194589148488195,$2.17,consequat morbi a ipsum integer a nibh in quis justo maecenas rhoncus aliquam lacus morbi quis
b-509,Lucina,Soares,lsoarese4@hibu.com,Female,209-936-2476,CO,8 Caliangt Point,232538,130.187.12.130,04/11/2018,2018-06-01 06:25:07,2018-10-01T07:44:24Z,1515313356,[{}],500.33,54,8.8105088,-75.632447,Peso,3578909431877743,$3.56,magnis dis parturient montes nascetur ridiculus mus etiam vel augue vestibulum rutrum rutrum neque aenean auctor gravida sem
b-510,Phillipp,Hounsom,phounsome5@ed.gov,Male,807-990-4405,ID,3 Tennessee Point,,119.36.227.92,02/05/2018,2018-02-05 21:27:33,2018-06-18T04:13:37Z,1526152991,"[{},{},{}]",668.5,27,-7.13386,113.51997,Rupiah,3530211168066807,$3.52,vitae ipsum aliquam non mauris morbi non lectus aliquam sit
b-511,Renado,Duns,rdunse6@harvard.edu,Male,219-596-7586,CN,39183 Mcbride Plaza,,184.123.115.152,08/02/2018,2018-02-07 18:57:53,2018-05-28T00:13:35Z,1520723105,"[{},{}]",466.1,68,24.923028,115.310042,Yuan Renminbi,5641828584778250,$6.24,eu mi nulla ac enim in tempor turpis nec euismod scelerisque quam
b-512,Leela,Fielders,lfielderse7@mail.ru,Female,913-221-4040,LV,7 Little Fleur Lane,,79.21.55.23,11/14/2018,2018-08-19 14:12:46,2017-12-21T00:35:12Z,1543125376,"[{},{},{}]",170.4,76,56.501455,25.878299,Euro,5002354194042618,$4.42,vivamus tortor duis mattis egestas metus aenean fermentum donec ut mauris eget massa tempor
b-513,Jocelyne,Walling,jwallinge8@blogs.com,Female,153-795-1799,RU,2 Lawn Hill,141508,172.193.50.41,04/21/2018,2018-10-16 16:13:03,2018-01-04T13:40:51Z,1538110907,[{}],409.59,74,56.176516,36.99786,Ruble,4175001545647124,$2.95,duis bibendum felis sed interdum venenatis turpis enim blandit mi in porttitor pede justo
b-514,Erv,Lammerts,elammertse9@homestead.com,Male,397-993-2823,NZ,099 Kingsford Plaza,5042,76.237.177.227,05/14/2018,2018-01-04 23:20:11,2018-01-29T13:24:19Z,1517740757,"[{},{},{}]",38.62,71,-41.2219337,174.8714559,Dollar,201686915773249,$6.63,libero quis orci nullam molestie nibh in lectus pellentesque at nulla suspendisse potenti cras in purus eu magna vulputate luctus
b-515,Jocelin,Sowerbutts,jsowerbuttsea@illinois.edu,Female,434-538-3453,ID,70 Columbus Road,,193.37.5.186,05/18/2018,2018-07-08 11:59:06,2018-06-04T02:44:03Z,1517216403,"[{},{},{},{},{}]",712.55,31,-6.7905128,111.9671537,Rupiah,5269772910432854,$5.78,vulputate vitae nisl aenean lectus pellentesque eget nunc donec quis orci eget orci vehicula condimentum curabitur in libero
b-516,Phineas,Seadon,pseadoneb@phpbb.com,Male,954-976-0591,ID,201 Loftsgordon Road,,220.112.10.251,09/03/2018,2018-10-02 10:56:01,2018-02-07T04:13:36Z,1514937869,"[{},{},{}]",297.02,2,-6.7047548,111.1280093,Rupiah,633480220565974194,$6.44,metus arcu adipiscing molestie hendrerit at vulputate vitae nisl aenean lectus pellentesque eget nunc donec quis orci
b-517,Farlee,Bridge,fbridgeec@ask.com,Male,572-427-1265,CN,63 David Park,,235.253.254.238,02/23/2018,2018-10-21 17:12:48,2018-04-09T09:45:55Z,1534187072,"[{},{},{},{},{}]",92.66,47,33.52575,105.91854,Yuan Renminbi,3535525221455664,$9.00,tortor sollicitudin mi sit amet lobortis sapien sapien non mi integer ac neque duis bibendum morbi non quam nec dui
b-518,Leroi,Aubert,lauberted@statcounter.com,Male,396-856-3331,AR,01 Surrey Road,5300,211.48.161.233,10/13/2018,2018-11-28 17:51:10,2018-06-25T21:57:29Z,1524091160,"[{},{}]",341.26,44,-32.9377962,-60.6961061,Peso,4041594113987,$4.08,quis augue luctus tincidunt nulla mollis molestie lorem quisque ut erat curabitur gravida nisi at
b-519,Brana,Ablewhite,bablewhiteee@sun.com,Female,947-526-0610,CN,47 Gale Pass,,5.198.115.102,04/09/2018,2018-07-25 09:15:19,2018-08-09T11:27:44Z,1537971422,[{}],248.42,41,26.433417,110.856622,Yuan Renminbi,201887429663401,$4.77,ante ipsum primis in faucibus orci luctus et ultrices posuere cubilia
b-520,Konstantine,Antrum,kantrumef@biglobe.ne.jp,Male,580-429-4987,CN,4 Bashford Hill,,77.18.242.164,06/08/2018,2018-11-09 18:03:56,2018-01-22T01:07:44Z,1530087846,"[{},{},{},{},{}]",123.73,14,35.604025,110.983333,Yuan Renminbi,201501566643478,$1.21,mattis odio donec vitae nisi nam ultrices libero non mattis pulvinar nulla pede ullamcorper augue a
b-521,Maryjo,Yoell,myoelleg@redcross.org,Female,641-122-6003,ID,4 Northport Circle,,23.121.126.176,10/14/2018,2018-11-20 13:01:01,2018-05-10T23:56:37Z,1528284319,[{}],87.17,31,-8.5693726,118.6557911,Rupiah,6333879130257613,$7.81,felis ut at dolor quis odio consequat varius integer ac leo pellentesque ultrices mattis odio donec vitae nisi
b-522,Susy,Pavelka,spavelkaeh@thetimes.co.uk,Female,559-856-6934,MA,36804 Heffernan Center,,8.232.142.170,12/26/2017,2018-07-07 23:39:09,2018-07-01T19:24:44Z,1514299257,"[{},{}]",763.93,57,34.8032705,-5.3442408,Dirham,6763253837263515054,$2.43,nec nisi volutpat eleifend donec ut dolor morbi vel lectus in quam
b-523,Jeannine,MacCorley,jmaccorleyei@bing.com,Female,654-132-8448,ID,4873 Village Green Point,,9.229.51.4,10/24/2018,2018-05-29 03:20:44,2018-07-30T13:16:43Z,1524392013,"[{},{},{},{}]",28.27,46,-8.6766175,122.1291843,Rupiah,3532178116295812,$4.67,ut erat id mauris vulputate elementum nullam varius nulla facilisi cras non velit nec nisi vulputate nonummy maecenas tincidunt lacus
b-524,Rosanne,Totterdill,rtotterdillej@hatena.ne.jp,Female,216-813-5202,FR,1 Schiller Point,50009 CEDEX,50.70.23.203,10/16/2018,2018-11-24 11:58:25,2018-09-07T11:36:16Z,1514346506,"[{},{},{},{},{}]",56.31,62,49.0993758,-1.0793373,Euro,3584686155674298,$0.67,pede lobortis ligula sit amet eleifend pede libero quis orci nullam
b-525,Hilliard,Crucitti,hcrucittiek@youtube.com,Male,492-480-4532,CO,08 American Ash Center,862069,189.6.99.98,09/09/2018,2018-10-18 17:52:37,2018-02-07T13:24:25Z,1518864411,"[{},{},{},{}]",771.62,21,0.5471811,-76.1319953,Peso,3576410706409462,$7.15,nunc nisl duis bibendum felis sed interdum venenatis turpis enim blandit mi in
b-526,Virginie,Glozman,vglozmanel@hibu.com,Female,323-666-9922,BR,287 Erie Drive,09700-000,247.60.135.155,08/20/2018,2018-04-05 03:12:15,2018-06-26T01:06:05Z,1519634883,"[{},{},{},{},{}]",43.98,37,-23.6898429,-46.5648481,Real,633307706781772397,$4.76,massa volutpat convallis morbi odio odio elementum eu interdum eu tincidunt in leo maecenas pulvinar
b-527,Henrik,Speare,hspeareem@weibo.com,Male,439-816-7758,ID,095 Saint Paul Trail,,240.50.92.149,09/15/2018,2018-02-23 12:56:36,2018-04-26T17:45:41Z,1521777351,"[{},{}]",587.55,61,-3.8277688,119.7773461,Rupiah,5602250483999407,$6.88,nulla tempus vivamus in felis eu sapien cursus vestibulum proin eu mi nulla ac enim in tempor
b-528,Griffith,Stedson,gstedsonen@multiply.com,Male,815-124-8286,CN,8245 Morningstar Parkway,,105.48.102.103,02/13/2018,2018-08-12 22:37:32,2018-04-06T11:38:44Z,1534453564,"[{},{}]",179.77,32,31.839084,106.763842,Yuan Renminbi,374288787270080,$1.24,ornare consequat lectus in est risus auctor sed tristique in tempus sit amet sem
b-529,Clemens,Bayman,cbaymaneo@blogspot.com,Male,,RU,,,70.231.73.26,03/04/2018,2018-08-14 22:16:37,2018-12-04T15:45:53Z,1529336493,,,,,,,,,
b-530,Burnard,Abad,babadep@sciencedaily.com,Male,821-454-5296,FI,255 Moose Crossing,63530,162.245.146.235,10/15/2018,2018-02-26 21:24:08,2018-06-11T17:00:52Z,1515508619,"[{},{},{}]",619.4,77,60.1946148,24.9584208,Euro,3545361999331798,$9.11,suscipit a feugiat et eros vestibulum ac est lacinia nisi venenatis tristique
b-531,Jilleen,Renols,jrenolseq@patch.com,Female,648-113-1682,CN,19 Roxbury Way,,222.65.23.241,03/29/2018,2018-06-21 13:16:41,2018-08-17T09:01:29Z,1524172688,"[{},{},{},{}]",93.42,19,28.125406,120.251605,Yuan Renminbi,5100149187653111,$2.00,iaculis congue vivamus metus arcu adipiscing molestie hendrerit at vulputate vitae nisl aenean lectus pellentesque eget
b-532,Emmeline,Reding,eredinger@fotki.com,Female,681-382-1400,BG,539 Ilene Crossing,5056,95.28.189.219,07/12/2018,2018-05-13 06:41:35,2018-10-25T04:06:36Z,1522431369,[{}],714.99,45,42.7083255,23.2929533,Lev,3532440370615592,$6.14,magna at nunc commodo placerat praesent blandit nam nulla integer pede justo lacinia eget tincidunt eget tempus vel pede
b-533,Joyce,Dugan,jduganes@mapquest.com,Female,646-947-0506,CN,1481 Di Loreto Point,,196.2.67.83,04/30/2018,2018-09-16 05:44:38,2018-04-13T23:45:12Z,1525999520,[{}],750.88,63,25.489999,103.796167,Yuan Renminbi,56022515830413731,$9.24,quis lectus suspendisse potenti in eleifend quam a odio in hac habitasse platea dictumst
b-534,Randa,O' Mahony,romahonyet@ning.com,Female,133-475-9650,RU,802 Lakewood Gardens Circle,309999,6.182.230.4,04/04/2018,2018-01-28 11:42:17,2018-04-24T16:53:48Z,1540602510,"[{},{},{}]",351.53,68,50.2350707,38.0596975,Ruble,4026042314528492,$4.49,at nunc commodo placerat praesent blandit nam nulla integer pede justo lacinia eget tincidunt
b-535,Aldin,Rudolf,arudolfeu@nifty.com,Male,338-856-1467,MX,53 Claremont Street,51355,20.92.241.115,03/19/2018,2018-03-09 19:25:27,2018-03-07T12:30:18Z,1519064556,[{}],183.34,34,17.7409147,-91.7660525,Peso,5002354474270467,$6.80,consequat morbi a ipsum integer a nibh in quis justo
b-536,Constancy,Siehard,csiehardev@aol.com,Female,685-757-6635,PL,94642 Ridgeview Alley,77-140,68.203.31.11,06/11/2018,2018-10-01 01:51:32,2018-12-03T12:23:30Z,1543949975,"[{},{},{}]",162.94,52,54.2388118,17.2312846,Zloty,3554381665040448,$9.04,nulla pede ullamcorper augue a suscipit nulla elit ac nulla sed vel enim sit
b-537,Marwin,Andreacci,mandreacciew@ftc.gov,Male,153-821-2579,TH,5477 Logan Avenue,82160,214.158.106.83,04/05/2018,2017-12-18 15:45:16,2018-05-09T08:56:13Z,1543114278,"[{},{},{}]",522.34,11,13.9619203,100.5461093,Baht,3545831826221156,$2.32,potenti nullam porttitor lacus at turpis donec posuere metus vitae ipsum aliquam non
b-538,Rolf,Boniface,rbonifaceex@tmall.com,Male,414-658-1065,RU,8355 Bartelt Center,353710,196.70.155.188,11/09/2018,2018-03-25 10:33:47,2018-10-16T08:48:51Z,1518852237,"[{},{}]",143.82,25,46.3187542,38.7465307,Ruble,4903470515410698194,$0.78,amet justo morbi ut odio cras mi pede malesuada in imperdiet et commodo vulputate justo
b-539,Elset,Shovel,eshoveley@1688.com,Female,723-456-7953,CN,759 Holmberg Alley,,30.152.228.157,08/18/2018,2018-03-07 09:31:09,2018-06-12T07:31:50Z,1523046383,"[{},{},{},{}]",60.71,13,41.068909,122.949298,Yuan Renminbi,201796239901317,$8.74,vulputate ut ultrices vel augue vestibulum ante ipsum primis in faucibus orci luctus et ultrices
b-540,Rayna,Myford,rmyfordez@youtu.be,Female,727-607-3430,CO,298 Sherman Point,134008,151.92.38.134,09/28/2018,2018-08-06 19:07:22,2018-11-24T16:14:35Z,1514558729,"[{},{},{},{},{}]",510.58,30,8.9245,-74.47033,Peso,503814275906686230,$0.48,sodales sed tincidunt eu felis fusce posuere felis sed lacus morbi sem mauris laoreet
b-541,Moses,Gobert,mgobertf0@auda.org.au,Male,205-641-3078,JP,14 Bobwhite Trail,329-1311,248.87.76.118,07/19/2018,2018-01-23 16:26:25,2018-11-17T11:19:42Z,1541723844,"[{},{},{},{}]",358.05,25,36.6839265,139.9649414,Yen,5562746020824634,$8.78,ipsum primis in faucibus orci luctus et ultrices posuere cubilia curae donec pharetra magna vestibulum aliquet
b-542,Rolfe,Borrows,rborrowsf1@odnoklassniki.ru,Male,,FR,,,248.46.47.156,05/14/2018,2018-09-06 00:30:01,2018-09-15T17:58:55Z,1523162410,,,,,,,,,
b-543,Eddie,Macieja,emaciejaf2@sitemeter.com,Male,549-422-2716,CN,77348 Gateway Junction,,187.239.238.64,10/05/2018,2018-12-04 19:57:40,2018-06-08T16:55:38Z,1518583947,"[{},{}]",172.64,46,30.198506,119.497769,Yuan Renminbi,56108794199238867,$0.68,et ultrices posuere cubilia curae mauris viverra diam vitae quam suspendisse potenti nullam porttitor lacus at turpis donec
b-544,Zebadiah,Brigge,zbriggef3@smh.com.au,Male,589-969-1523,MY,7322 Graedel Circle,88592,27.203.133.136,02/22/2018,2018-09-29 14:35:05,2018-02-16T20:28:46Z,1521864660,"[{},{},{},{}]",773.54,61,5.952775,116.05657,Ringgit,3528802457150379,$4.10,in sapien iaculis congue vivamus metus arcu adipiscing molestie hendrerit at
b-545,Kial,Hambright,khambrightf4@wsj.com,Female,736-140-6760,PH,3 Meadow Ridge Pass,8701,198.163.115.37,02/09/2018,2018-07-10 20:16:07,2018-05-14T10:14:04Z,1529423687,"[{},{}]",188.63,56,13.0553726,123.3014932,Peso,3553846758024971,$5.60,magna at nunc commodo placerat praesent blandit nam nulla integer pede
b-546,Farah,Colleton,fcolletonf5@mit.edu,Female,891-886-9873,BR,11 Raven Alley,01000-000,128.155.53.234,11/02/2018,2018-04-12 05:13:17,2018-10-22T09:35:15Z,1527069552,"[{},{}]",225.3,45,-23.572516,-46.668437,Real,560225354514229270,$3.36,ut dolor morbi vel lectus in quam fringilla rhoncus mauris enim leo rhoncus sed vestibulum sit amet
b-547,Loria,Finneran,lfinneranf6@t.co,Female,897-555-1307,UA,22368 Petterle Trail,,228.232.248.0,11/08/2018,2018-06-08 15:48:58,2018-09-02T21:10:04Z,1523927833,"[{},{},{},{}]",604.28,11,48.3842974,25.5058522,Hryvnia,4917199974810891,$5.83,at turpis donec posuere metus vitae ipsum aliquam non mauris morbi non lectus aliquam sit amet diam in magna
b-548,Zechariah,Elvey,zelveyf7@over-blog.com,Male,868-439-1860,SE,92 Golden Leaf Court,375 90,211.155.183.109,03/09/2018,2018-02-03 23:11:10,2018-02-03T06:26:58Z,1542127356,"[{},{},{},{}]",651.28,59,56.1747912,14.756367,Krona,3563191428541452,$5.88,at feugiat non pretium quis lectus suspendisse potenti in eleifend quam a odio in hac habitasse
b-549,Etti,Leere,eleeref8@xrea.com,Female,906-579-9296,RU,46 Lawn Way,366002,34.131.99.224,08/01/2018,2018-05-19 01:04:22,2018-10-17T02:07:41Z,1525704530,"[{},{},{},{},{}]",543.61,19,43.4009223,45.5278152,Ruble,564182127576468413,$3.71,odio consequat varius integer ac leo pellentesque ultrices mattis odio donec vitae nisi nam ultrices libero non mattis pulvinar nulla
b-550,Eimile,MacCallister,emaccallisterf9@ezinearticles.com,Female,435-251-0014,BR,7 Shopko Lane,55840-000,52.36.117.6,04/07/2018,2018-05-12 11:32:23,2018-03-26T23:11:21Z,1541994905,"[{},{},{},{}]",356.69,30,-7.934176,-35.2920979,Real,201975765833447,$4.62,semper rutrum nulla nunc purus phasellus in felis donec semper sapien
b-551,Forest,Birwhistle,fbirwhistlefa@creativecommons.org,Male,368-649-5912,AE,2374 Lindbergh Point,,107.178.55.96,11/24/2018,2018-11-20 07:02:01,2018-02-11T07:52:46Z,1521822837,"[{},{},{},{},{}]",25.01,69,25.3462553,55.4209317,Dirham,30371674827646,$5.93,vel augue vestibulum rutrum rutrum neque aenean auctor gravida sem praesent id massa id nisl
b-552,Harrie,Beldham,hbeldhamfb@ezinearticles.com,Female,213-997-7383,CN,31522 Crowley Circle,,50.175.116.153,10/11/2018,2018-09-19 23:58:03,2018-02-12T08:52:59Z,1513011295,"[{},{},{}]",440.84,55,35.8939566,117.9249002,Yuan Renminbi,3561616982070755,$6.47,turpis integer aliquet massa id lobortis convallis tortor risus dapibus augue vel accumsan tellus nisi eu
b-553,Viv,Dugdale,vdugdalefc@homestead.com,Female,799-601-2782,TH,487 Northview Alley,34170,68.12.0.227,06/25/2018,2018-04-18 16:33:41,2018-07-12T09:12:53Z,1532156100,"[{},{},{}]",228.11,34,16.0481202,105.1375908,Baht,3586411755890295,$4.94,a suscipit nulla elit ac nulla sed vel enim sit amet nunc viverra
b-554,Mason,Minchindon,mminchindonfd@studiopress.com,Male,274-750-8984,FR,9 Holy Cross Lane,57751 CEDEX 9,193.87.196.43,01/27/2018,2018-01-07 13:04:33,2018-02-03T16:45:18Z,1531861248,"[{},{},{},{}]",295.9,34,49.1441362,6.1519975,Euro,5602246580749893,$2.36,cubilia curae duis faucibus accumsan odio curabitur convallis duis consequat dui nec nisi volutpat eleifend
b-555,Lorens,Seaborne,lseabornefe@bing.com,Male,412-767-3572,NG,11 Hazelcrest Street,,185.125.160.213,06/30/2018,2018-10-27 00:19:18,2018-10-25T00:52:19Z,1540628857,"[{},{},{},{},{}]",261.71,69,6.7367367,7.0014657,Naira,5602257905282114,$6.06,morbi non quam nec dui luctus rutrum nulla tellus in sagittis
b-556,Ewen,Remer,eremerff@google.co.jp,Male,641-114-9863,ID,97678 Ilene Court,,255.12.178.99,04/05/2018,2018-02-21 06:05:16,2018-05-13T14:59:57Z,1540842462,"[{},{},{},{}]",593.61,40,-7.8225811,110.3615247,Rupiah,3589506194149448,$3.94,luctus nec molestie sed justo pellentesque viverra pede ac diam cras pellentesque volutpat dui maecenas
b-557,Kayne,Leech,kleechfg@rambler.ru,Male,180-924-9642,CN,1257 Merrick Point,,116.220.250.126,02/27/2018,2018-07-10 10:52:55,2017-12-21T06:42:27Z,1517334183,"[{},{},{}]",314.33,9,27.018126,114.370929,Yuan Renminbi,4936052985463191,$1.17,scelerisque mauris sit amet eros suspendisse accumsan tortor quis turpis sed
b-558,Sheelagh,Desesquelle,sdesesquellefh@shinystat.com,Female,353-680-3631,UA,3687 Oak Valley Way,,247.79.128.79,08/14/2018,2018-11-14 23:17:28,2018-01-24T03:03:39Z,1527244218,"[{},{},{},{}]",92.09,19,48.6739771,28.8563795,Hryvnia,3578031917030422,$5.98,luctus cum sociis natoque penatibus et magnis dis parturient montes nascetur ridiculus mus vivamus vestibulum sagittis sapien cum sociis
b-559,Dix,Bew,dbewfi@constantcontact.com,Female,609-174-2436,KZ,30218 Hoepker Lane,,52.34.116.29,05/12/2018,2018-10-14 21:01:55,2018-07-22T11:06:40Z,1512680001,[{}],604.7,14,43.5561243,77.9995589,Tenge,3580490802081823,$2.82,etiam justo etiam pretium iaculis justo in hac habitasse platea dictumst etiam faucibus cursus
b-560,Mayne,Borth,mborthfj@house.gov,Male,424-412-8907,PH,224 Fieldstone Circle,2517,134.154.143.115,01/03/2018,2018-08-01 22:06:58,2018-10-07T13:31:21Z,1522637565,"[{},{},{},{},{}]",104.1,54,16.802718,120.401159,Peso,502010494447857176,$3.91,quis lectus suspendisse potenti in eleifend quam a odio in hac habitasse platea dictumst maecenas ut massa quis augue luctus
b-561,Genna,Ferfulle,gferfullefk@ed.gov,Female,157-291-7864,CZ,291 Center Plaza,725 27,217.115.145.151,01/31/2018,2018-05-24 00:57:21,2018-08-02T10:45:18Z,1513910203,"[{},{},{}]",154.87,48,49.8575338,18.1508117,Koruna,5100148450910240,$7.26,velit donec diam neque vestibulum eget vulputate ut ultrices vel augue vestibulum ante ipsum primis in faucibus orci luctus
b-562,Zea,Tedahl,ztedahlfl@aol.com,Female,456-169-4215,RU,0996 Brentwood Lane,456113,11.222.218.27,12/13/2017,2018-06-18 15:47:04,2018-03-04T17:52:06Z,1542332533,"[{},{},{}]",507.97,25,54.7674474,58.2897934,Ruble,5602211892140967,$5.85,turpis elementum ligula vehicula consequat morbi a ipsum integer a nibh
b-563,Meridith,Bartomeu,mbartomeufm@1und1.de,Female,207-190-6450,SE,45 Namekagon Parkway,285 35,117.49.101.119,11/04/2018,2018-11-16 06:58:28,2018-01-29T02:28:57Z,1533242053,[{}],343.97,41,56.4477313,13.6156546,Krona,3579639902677343,$6.00,donec semper sapien a libero nam dui proin leo odio porttitor id consequat in consequat ut nulla sed
b-564,Kiley,Gratten,kgrattenfn@google.cn,Male,670-549-4391,JP,361 Buhler Place,799-3115,74.242.113.2,06/08/2018,2018-07-09 09:02:54,2018-09-30T15:17:14Z,1523879851,"[{},{},{},{},{}]",757.17,40,33.9205932,134.4266559,Yen,3556751659237796,$3.09,leo pellentesque ultrices mattis odio donec vitae nisi nam ultrices libero non mattis pulvinar nulla pede ullamcorper
b-565,Betsy,Grebert,bgrebertfo@statcounter.com,Female,784-758-2088,HN,39374 Forest Dale Street,,160.255.153.43,10/15/2018,2018-10-15 23:52:06,2018-10-27T05:20:28Z,1528251614,[{}],472.35,36,14.08181,-85.994003,Lempira,3534554942562252,$4.79,donec dapibus duis at velit eu est congue elementum in
b-566,Malissia,Penhale,mpenhalefp@uiuc.edu,Female,471-432-9999,MX,35980 American Court,41240,122.251.118.159,05/18/2018,2017-12-10 04:37:20,2018-09-12T23:44:07Z,1535886139,"[{},{},{},{},{}]",662.85,22,18.1096868,-95.8803869,Peso,503826244946172946,$3.30,feugiat et eros vestibulum ac est lacinia nisi venenatis tristique fusce congue diam id ornare imperdiet
b-567,Kristal,Rawlings,krawlingsfq@state.gov,Female,123-491-3819,ID,5 Marquette Street,,187.224.243.143,02/04/2018,2018-12-06 07:21:53,2018-02-10T21:33:18Z,1539906159,[{}],672.72,39,-8.792325,120.960602,Rupiah,201835243116056,$4.35,proin at turpis a pede posuere nonummy integer non velit donec diam neque vestibulum eget vulputate ut ultrices vel augue
b-568,Duane,Sotheby,dsothebyfr@cocolog-nifty.com,Male,312-650-0408,CN,23766 Merrick Drive,,60.30.4.59,08/14/2018,2018-08-17 08:35:29,2018-06-08T18:22:48Z,1524315310,"[{},{},{}]",11.76,57,33.157445,106.834805,Yuan Renminbi,3535535758055415,$7.40,lorem quisque ut erat curabitur gravida nisi at nibh in hac habitasse platea dictumst aliquam augue quam
b-569,Lockwood,Wreath,lwreathfs@g.co,Male,711-560-8411,TN,217 West Pass,,169.184.248.104,03/11/2018,2018-05-13 06:08:44,2018-07-22T05:05:20Z,1520077759,"[{},{},{},{}]",495.14,25,36.7333193,9.1843676,Dinar,6390432417941689,$1.90,praesent blandit nam nulla integer pede justo lacinia eget tincidunt eget tempus vel pede morbi porttitor
b-570,Agata,Flockhart,aflockhartft@nifty.com,Female,850-717-9780,KR,0394 Corben Street,,137.113.28.64,08/02/2018,2017-12-29 12:27:20,2018-12-06T23:29:58Z,1543941118,"[{},{},{}]",373.76,13,36.60123,126.6607764,Won,3550527851686303,$1.75,iaculis congue vivamus metus arcu adipiscing molestie hendrerit at vulputate vitae nisl aenean lectus
b-571,Pia,Banthorpe,pbanthorpefu@marriott.com,Female,873-123-6116,JP,22455 Dayton Avenue,989-1505,113.217.38.73,09/29/2018,2018-05-02 22:04:07,2017-12-31T16:52:34Z,1531157261,[{}],499.49,50,38.1861536,140.6675584,Yen,3541879236867575,$0.56,quam pede lobortis ligula sit amet eleifend pede libero quis orci
