id,first_name,last_name,email,gender,phone,country,address,postal_code,ip_address,date_format1,date_SQL_datetime,date_ISO8601_UTC,epoch,json_array,decimal_number,natural_number,latitude,longitude,currency,credict_card_number,price,description
a-471,Luis,Beevens,lbeevensd2@geocities.com,Male,740-748-2978,CN,545 Mitchell Street,,212.137.69.189,11/23/2018,2018-06-30 02:15:24,2018-01-21T18:47:44Z,1534278847,"[{},{}]",340.93,44,25.606486,100.267638,Yuan Renminbi,3572887165634967,$2.10,tellus semper interdum mauris ullamcorper purus sit amet nulla quisque arcu libero rutrum ac lobortis vel dapibus at diam
a-472,Gustavo,McCard,gmccardd3@gmpg.org,Male,898-138-4007,ID,1 Grasskamp Parkway,,153.234.119.218,08/04/2018,2018-11-28 15:51:53,2018-07-04T10:49:10Z,1524862187,[{}],310.76,35,-8.1831,111.5359,Rupiah,5010128825797844,$8.35,pellentesque ultrices phasellus id sapien in sapien iaculis congue vivamus metus arcu adipiscing molestie hendrerit at
a-473,Andrea,Simyson,asimysond4@baidu.com,Male,,JP,,,213.116.143.95,09/02/2018,2018-01-25 22:31:37,2018-04-20T03:00:04Z,1542657670,,,,,,,,,
a-474,Leland,Thexton,lthextond5@t.co,Female,566-960-6904,MV,409 Johnson Plaza,,244.145.161.97,02/28/2018,2018-11-07 23:29:08,2018-04-12T03:08:17Z,1527454222,[{}],440.19,8,5.7650768,73.4106543,Rufiyaa,3574473909096918,$4.23,odio in hac habitasse platea dictumst maecenas ut massa quis augue luctus tincidunt nulla mollis molestie lorem quisque ut erat
a-475,Felicio,Tippett,ftippettd6@geocities.com,Male,235-651-0716,CN,725 Helena Drive,,214.248.38.185,01/29/2018,2018-11-20 04:06:09,2018-05-23T21:07:24Z,1517551886,"[{},{},{},{},{}]",543.11,28,35.293048,112.390857,Yuan Renminbi,3528682901179020,$2.45,nec euismod scelerisque quam turpis adipiscing lorem vitae mattis nibh ligula nec sem duis aliquam
a-476,Margette,O'Cannavan,mocannavand7@timesonline.co.uk,Female,552-570-0877,SE,378 Golden Leaf Park,806 31,16.230.135.112,08/01/2018,2018-02-14 22:30:46,2018-02-16T16:15:18Z,1533630917,"[{},{},{}]",292.11,30,60.6875251,17.1114439,Krona,3576510497261061,$8.43,id turpis integer aliquet massa id lobortis convallis tortor risus dapibus augue vel accumsan tellus
a-477,Tabby,Hebblewhite,thebblewhited8@exblog.jp,Male,733-837-9682,CN,5444 Kenwood Trail,,141.11.25.160,08/12/2018,2018-10-15 04:29:23,2018-01-27T14:45:22Z,1539538580,[{}],299.26,35,35.545649,118.161586,Yuan Renminbi,5100148483515743,$4.15,aliquet at feugiat non pretium quis lectus suspendisse potenti in eleifend quam a odio in hac
a-478,Dinah,Conwell,dconwelld9@scientificamerican.com,Female,355-986-8065,FR,85786 Orin Avenue,13155 CEDEX,99.81.54.215,11/27/2018,2018-02-03 10:00:34,2018-10-31T22:17:20Z,1543557619,"[{},{},{}]",617.78,39,44.1640152,3.8481099,Euro,3583280257502036,$7.71,mauris morbi non lectus aliquam sit amet diam in magna bibendum
a-479,Letitia,Mohun,lmohunda@ustream.tv,Female,612-650-0404,ID,52 Hagan Trail,,241.183.19.40,02/23/2018,2018-04-30 20:58:28,2018-09-07T21:47:43Z,1536201098,"[{},{},{},{}]",524.55,51,1.6832081,101.4537902,Rupiah,3528958292607930,$6.79,ipsum praesent blandit lacinia erat vestibulum sed magna at nunc commodo placerat praesent blandit nam nulla
a-480,Lotta,Jancey,ljanceydb@mozilla.org,Female,,UA,,,53.214.193.98,11/10/2018,2018-11-02 20:18:50,2018-05-13T00:54:46Z,1519997422,,,,,,,,,
a-481,Quentin,Wildman,qwildmandc@livejournal.com,Male,452-771-4341,PT,9198 Melby Center,9700-406,100.6.167.144,01/18/2018,2018-05-03 19:02:43,2018-04-03T00:09:28Z,1537998875,"[{},{},{},{},{}]",742.7,12,38.789257,-27.327988,Euro,5020196063813217,$7.24,lorem ipsum dolor sit amet consectetuer adipiscing elit proin interdum mauris non ligula pellentesque ultrices phasellus id sapien in
a-482,Garvin,Chidlow,gchidlowdd@webnode.com,Male,619-976-3503,CN,2567 Ohio Place,,191.232.116.134,07/08/2018,2018-01-04 19:03:08,2018-02-27T00:25:48Z,1513171664,[{}],453.04,9,38.645085,106.614063,Yuan Renminbi,677146962744781866,$8.69,semper sapien a libero nam dui proin leo odio porttitor id consequat in consequat ut nulla
a-483,Farlie,Babst,fbabstde@gov.uk,Male,,US,,,107.114.45.215,02/10/2018,2018-02-13 19:01:06,2018-11-22T00:48:47Z,1521366930,,,,,,,,,
a-484,Lowell,Biermatowicz,lbiermatowiczdf@dropbox.com,Male,938-294-2191,AF,74 Starling Plaza,,174.54.48.197,10/30/2018,2017-12-23 05:37:59,2018-06-25T08:56:34Z,1526938533,"[{},{},{},{}]",568.85,39,36.6926167,67.1179511,Afghani,3540511725884297,$8.02,penatibus et magnis dis parturient montes nascetur ridiculus mus vivamus
a-485,Georgi,Gatteridge,ggatteridgedg@biblegateway.com,Male,893-558-3377,CU,88 Grim Circle,,179.134.71.251,03/22/2018,2018-09-18 21:48:32,2018-10-13T10:58:42Z,1538203965,[{}],204.51,2,22.1466556,-79.9780178,Peso,3552728843637705,$8.60,nunc viverra dapibus nulla suscipit ligula in lacus curabitur at ipsum
a-486,Tana,Sukbhans,tsukbhansdh@cloudflare.com,Female,601-575-0352,FR,707 Boyd Plaza,75853 CEDEX 17,49.158.2.99,08/14/2018,2018-07-28 05:16:18,2018-03-11T08:32:51Z,1537054405,"[{},{},{},{}]",621.82,68,43.4945737,5.8978018,Euro,3537459262198140,$3.67,pretium iaculis diam erat fermentum justo nec condimentum neque sapien placerat ante nulla justo
a-487,Delmor,Lobell,dlobelldi@free.fr,Male,501-811-2470,CN,2408 Huxley Center,,169.149.139.252,10/28/2018,2018-04-07 04:41:48,2018-07-23T17:20:02Z,1520598786,"[{},{}]",296.07,34,26.4836842,117.9249002,Yuan Renminbi,5893455138463477639,$6.14,libero nullam sit amet turpis elementum ligula vehicula consequat morbi
a-488,Caryl,Drawmer,cdrawmerdj@cocolog-nifty.com,Female,770-669-1026,MU,2747 Esker Circle,,237.13.22.150,07/26/2018,2018-05-21 17:38:51,2018-10-04T15:27:11Z,1536399221,"[{},{},{}]",153.1,36,-20.3656796,57.6424881,Rupee,201599448277465,$8.23,luctus et ultrices posuere cubilia curae donec pharetra magna vestibulum aliquet ultrices erat tortor sollicitudin mi
a-489,Lurleen,Keep,lkeepdk@topsy.com,Female,,CN,,,5.97.95.214,02/28/2018,2017-12-25 18:17:41,2018-10-11T16:44:31Z,1542041028,,,,,,,,,
a-490,Cristy,Everix,ceverixdl@odnoklassniki.ru,Female,618-849-4511,PE,478 Fulton Plaza,,174.232.214.179,02/09/2018,2018-04-09 19:06:24,2017-12-30T13:11:42Z,1527564896,"[{},{},{}]",146.9,75,-15.12142,-70.929367,Sol,5207180936808922,$8.12,proin leo odio porttitor id consequat in consequat ut nulla sed accumsan felis ut at dolor quis odio consequat varius
a-491,Garry,Wands,gwandsdm@vkontakte.ru,Male,964-762-1373,PT,71 Pine View Plaza,4990-670,143.100.50.150,08/05/2018,2018-08-22 06:03:49,2018-06-04T18:11:24Z,1530293687,"[{},{}]",185.36,64,41.7811503,-8.6240851,Euro,5602250461246052,$4.15,justo maecenas rhoncus aliquam lacus morbi quis tortor id nulla
a-492,Ransell,Mudle,rmudledn@blogs.com,Male,670-467-4103,ID,900 Lillian Parkway,,32.223.92.248,01/29/2018,2018-03-01 06:26:28,2018-06-28T06:28:59Z,1527531810,"[{},{},{},{},{}]",224.58,23,-6.2287891,106.6914555,Rupiah,3581759873944112,$7.23,pede ullamcorper augue a suscipit nulla elit ac nulla sed vel enim sit amet nunc viverra dapibus
a-493,Charla,Farans,cfaransdo@ed.gov,Female,841-513-5949,EG,59487 Toban Parkway,,238.111.160.248,03/11/2018,2018-08-22 05:02:45,2018-05-29T03:30:29Z,1531445585,[{}],534.0,1,29.3594128,30.6816163,Pound,4508182736940623,$4.94,sed accumsan felis ut at dolor quis odio consequat varius integer ac leo pellentesque ultrices mattis odio donec vitae
a-494,Ulrick,Belliveau,ubelliveaudp@sbwire.com,Male,914-336-9579,PL,01337 Ilene Parkway,32-082,79.39.42.217,07/31/2018,2018-11-07 18:42:44,2018-04-20T02:26:32Z,1538434383,"[{},{},{},{}]",167.99,23,50.222479,19.772052,Zloty,4026130972305103,$8.30,luctus et ultrices posuere cubilia curae donec pharetra magna vestibulum
a-495,Osmond,Cathie,ocathiedq@cpanel.net,Male,475-348-1097,CN,8 Bartelt Crossing,,52.138.231.119,09/03/2018,2018-01-28 13:48:14,2018-09-26T11:06:26Z,1529220724,"[{},{}]",709.23,47,34.395562,113.740529,Yuan Renminbi,201890480682914,$2.57,lobortis convallis tortor risus dapibus augue vel accumsan tellus nisi
a-496,Gib,Wilds,gwildsdr@redcross.org,Male,852-511-7001,ID,96 Oak Parkway,,186.73.92.63,04/03/2018,2018-07-31 04:39:33,2018-10-10T15:00:21Z,1526415528,[{}],108.32,53,-6.2167736,106.5230542,Rupiah,3555475124925527,$2.97,at nulla suspendisse potenti cras in purus eu magna vulputate luctus cum sociis natoque penatibus et magnis
a-497,Ingeberg,Wooland,iwoolandds@wix.com,Female,604-901-7843,PT,54 Oak Valley Plaza,2450-104,167.133.155.189,12/26/2017,2018-02-07 22:27:09,2018-10-14T16:19:24Z,1518966978,"[{},{},{},{},{}]",501.69,11,39.6012147,-9.0700991,Euro,5102013990791674,$3.95,rutrum neque aenean auctor gravida sem praesent id massa id nisl venenatis lacinia aenean sit amet justo morbi
a-498,Lula,Dunmore,ldunmoredt@umich.edu,Female,951-280-5780,AR,46 Jana Road,5280,167.82.217.73,05/02/2018,2018-10-13 23:24:05,2018-10-04T13:47:43Z,1542111327,"[{},{}]",643.42,58,-31.4847366,-64.2108962,Peso,5602241513053554,$4.62,nulla integer pede justo lacinia eget tincidunt eget tempus vel pede morbi
a-499,Waverley,Dami,wdamidu@prnewswire.com,Male,679-493-4328,AM,9 Bultman Center,,220.213.188.178,08/02/2018,2018-07-24 07:52:49,2018-08-15T09:27:56Z,1517706831,"[{},{},{},{}]",464.8,70,39.9716709,44.5352163,Dram,3560594746919016,$5.54,lorem ipsum dolor sit amet consectetuer adipiscing elit proin interdum mauris non ligula
a-500,Rolando,Swate,rswatedv@woothemes.com,Male,851-739-1458,CN,50 Village Court,,44.111.45.181,11/08/2018,2018-03-18 12:32:38,2018-10-16T20:46:45Z,1516028366,"[{},{}]",361.06,49,42.3683369,125.4352358,Yuan Renminbi,67625092671813989,$1.99,lectus vestibulum quam sapien varius ut blandit non interdum in ante
a-501,Eula,Radsdale,eradsdaledw@pen.io,Female,564-870-2120,BR,844 Comanche Terrace,11250-000,139.68.222.3,12/27/2017,2018-08-25 20:44:32,2018-04-14T18:20:33Z,1531788784,"[{},{},{}]",602.91,43,-23.8182859,-46.0851681,Real,5602246010548477,$0.10,eu felis fusce posuere felis sed lacus morbi sem mauris laoreet ut rhoncus aliquet pulvinar sed
a-502,Gale,Roscoe,groscoedx@ftc.gov,Female,661-790-9562,CM,4409 Manley Center,,69.211.60.21,12/06/2018,2018-09-04 14:04:41,2018-10-25T23:51:19Z,1535237553,"[{},{},{}]",271.81,64,3.7953482,10.1367166,Franc,4936611633067942,$0.76,vulputate vitae nisl aenean lectus pellentesque eget nunc donec quis orci eget orci vehicula condimentum curabitur in libero ut
a-503,Tedi,Renfrew,trenfrewdy@ocn.ne.jp,Female,385-721-1137,BR,94 Pankratz Terrace,08600-000,20.132.222.219,09/22/2018,2018-07-26 09:45:50,2018-10-16T23:42:20Z,1524855435,"[{},{},{}]",743.0,58,-23.527748,-46.3266408,Real,379990037704298,$0.93,ut suscipit a feugiat et eros vestibulum ac est lacinia
a-504,Aloise,Guite,aguitedz@istockphoto.com,Female,,JM,,,249.175.237.41,12/03/2018,2017-12-17 13:48:50,2018-07-17T20:05:32Z,1529650841,,,,,,,,,
a-505,Heinrick,Dalgarnocht,hdalgarnochte0@google.pl,Male,,RS,,,102.222.219.5,04/25/2018,2018-04-06 21:19:29,2017-12-08T14:45:55Z,1525909273,,,,,,,,,
a-506,Bevan,Cumberland,bcumberlande1@economist.com,Male,821-245-5412,CN,5427 Schiller Park,,107.192.250.46,09/08/2018,2018-02-08 02:53:13,2017-12-09T19:00:46Z,1539075457,"[{},{},{},{},{}]",712.43,76,25.318672,119.105528,Yuan Renminbi,4175002584874363,$7.98,sapien cum sociis natoque penatibus et magnis dis parturient montes
a-507,Willem,Joder,wjodere2@booking.com,Male,329-202-2198,TH,909 Vernon Road,26120,158.44.119.239,05/13/2018,2018-06-20 08:06:01,2018-09-21T17:35:59Z,1536954959,[{}],53.26,74,14.0786882,101.0259275,Baht,501872672613400322,$0.47,id lobortis convallis tortor risus dapibus augue vel accumsan tellus nisi
a-508,Roman,Frohock,rfrohocke3@squarespace.com,Male,965-566-1686,RU,41789 Farragut Crossing,368959,122.104.3.121,07/26/2018,2018-05-14 20:29:02,2018-07-11T23:29:46Z,1528548788,"[{},{}]",395.3,25,42.7590695,46.8392256,Ruble,4903290567197305442,$3.76,consequat metus sapien ut nunc vestibulum ante ipsum primis in faucibus orci luctus et ultrices posuere cubilia curae mauris viverra
a-509,Rex,Puttergill,rputtergille4@go.com,Male,845-157-3128,JP,42128 Kinsman Way,881-0033,25.40.223.99,12/03/2018,2018-11-17 08:20:46,2018-06-02T14:21:21Z,1542262877,"[{},{},{}]",768.3,52,32.1030654,131.3999389,Yen,3542886859945561,$8.19,lectus pellentesque eget nunc donec quis orci eget orci vehicula condimentum curabitur in libero ut massa volutpat convallis morbi odio
a-510,Katherina,Garfoot,kgarfoote5@jalbum.net,Female,806-733-3671,HN,8561 Darwin Hill,,55.181.228.174,02/18/2018,2018-06-01 06:29:22,2018-07-18T12:55:50Z,1538041775,[{}],488.11,54,15.1249413,-88.4415998,Lempira,3547061058558236,$8.40,mattis egestas metus aenean fermentum donec ut mauris eget massa
a-511,Eliza,Harvie,eharviee6@imgur.com,Female,308-882-3797,PY,9467 Coleman Point,,37.53.112.160,06/01/2018,2018-08-28 15:49:45,2018-04-16T00:19:20Z,1542938490,"[{},{},{},{},{}]",641.6,61,-25.408157,-57.2875097,Guarani,3555825599802835,$9.19,convallis tortor risus dapibus augue vel accumsan tellus nisi eu orci mauris lacinia sapien quis libero nullam
a-512,Courtenay,Baldini,cbaldinie7@sbwire.com,Female,561-150-5914,CN,26537 Golf View Parkway,,225.2.120.30,11/10/2018,2018-09-16 08:33:22,2018-11-25T03:00:15Z,1533116868,"[{},{},{}]",282.23,22,27.829795,112.944026,Yuan Renminbi,6333421812469339,$6.13,non lectus aliquam sit amet diam in magna bibendum imperdiet nullam orci pede venenatis non sodales
a-513,Hillier,Fynes,hfynese8@earthlink.net,Male,321-347-8447,CN,131 Melody Pass,,49.34.27.134,06/16/2018,2018-09-10 17:31:42,2018-01-31T12:29:20Z,1519431178,[{}],224.65,77,26.1695432,118.1859781,Yuan Renminbi,6333291604248161,$4.05,sagittis sapien cum sociis natoque penatibus et magnis dis parturient montes
a-514,Amalia,Hedderly,ahedderlye9@wufoo.com,Female,394-930-8192,CN,843 Marquette Avenue,,251.38.9.77,07/25/2018,2018-09-24 09:32:15,2018-08-09T21:32:15Z,1529323017,"[{},{},{},{}]",220.77,67,28.159141,115.771093,Yuan Renminbi,3554698126129373,$5.18,aliquet at feugiat non pretium quis lectus suspendisse potenti in eleifend quam a odio in hac habitasse platea dictumst
a-515,Claiborne,Card,ccardea@wikispaces.com,Male,140-823-5743,HR,3638 Orin Way,52212,96.121.206.58,04/13/2018,2018-06-20 03:39:15,2018-06-02T05:29:37Z,1518878954,[{}],583.98,77,44.9248529,13.8198739,Kuna,3548099897347014,$6.39,erat volutpat in congue etiam justo etiam pretium iaculis justo in hac habitasse platea dictumst
a-516,Ruperto,Cool,rcooleb@va.gov,Male,101-948-0742,CN,0 Atwood Point,,25.162.142.220,06/12/2018,2018-11-24 00:40:23,2018-03-03T05:09:42Z,1529528221,"[{},{},{},{},{}]",590.79,49,44.275895,123.9674831,Yuan Renminbi,4405112278037029,$0.57,ligula suspendisse ornare consequat lectus in est risus auctor sed
a-517,Thibaut,Fannin,tfanninec@apple.com,Male,914-962-1030,RU,902 Erie Plaza,422343,94.146.200.129,04/24/2018,2018-11-02 03:42:22,2018-04-22T20:40:03Z,1520571340,"[{},{},{}]",90.31,72,55.792891,37.671626,Ruble,5602254982790424,$5.34,sapien cum sociis natoque penatibus et magnis dis parturient montes
a-518,Modesty,Dyka,mdykaed@networksolutions.com,Female,530-222-3397,CN,5426 Forest Hill,,110.177.60.245,08/18/2018,2018-05-24 16:08:21,2018-03-28T21:46:23Z,1544004515,"[{},{},{},{}]",457.13,3,39.772554,98.289419,Yuan Renminbi,201488924791530,$1.35,enim lorem ipsum dolor sit amet consectetuer adipiscing elit proin interdum mauris non ligula
a-519,Case,Lealle,clealleee@123-reg.co.uk,Male,309-673-3599,HR,1400 West Terrace,49232,201.190.234.241,06/17/2018,2018-11-29 07:25:40,2018-04-16T18:14:48Z,1540785716,"[{},{},{},{}]",691.87,55,46.1629456,15.9296045,Kuna,4405207371296181,$6.88,porttitor pede justo eu massa donec dapibus duis at velit eu est congue elementum
a-520,Janey,Aspinell,jaspinellef@github.io,Female,426-141-2983,PT,7 Arkansas Hill,3405-305,212.248.165.24,11/27/2018,2018-10-05 02:55:56,2018-04-27T07:43:17Z,1538138337,[{}],306.38,38,40.3779093,-7.8440342,Euro,30449478265955,$1.96,volutpat eleifend donec ut dolor morbi vel lectus in quam
a-521,Henrietta,Canavan,hcanavaneg@mediafire.com,Female,827-677-7451,ID,07 4th Lane,,159.93.63.241,05/31/2018,2018-04-07 12:42:19,2018-05-20T13:13:13Z,1514679369,"[{},{},{},{},{}]",291.05,71,-6.2957395,107.8228459,Rupiah,348710509874025,$4.00,ullamcorper purus sit amet nulla quisque arcu libero rutrum ac lobortis vel dapibus at
a-522,Gustaf,Burston,gburstoneh@scribd.com,Male,155-665-8987,IR,35 Blaine Road,,11.199.14.14,06/11/2018,2018-10-21 12:55:39,2018-01-06T23:23:39Z,1531227070,"[{},{},{},{}]",609.9,27,36.649364,51.4887307,Rial,5242305286250857,$3.22,lacus at velit vivamus vel nulla eget eros elementum pellentesque quisque porta volutpat erat quisque erat eros viverra
a-523,Talbot,Mathe,tmatheei@technorati.com,Male,165-886-7255,CA,50844 Lotheville Parkway,J8R,82.127.44.121,06/24/2018,2018-05-04 21:17:49,2018-06-03T15:14:39Z,1521612597,"[{},{},{}]",693.83,34,45.4139794,-75.7103682,Dollar,5048379374841659,$8.10,porttitor pede justo eu massa donec dapibus duis at velit eu est congue elementum
a-524,Harrie,Delahunty,hdelahuntyej@vk.com,Female,307-544-9962,JP,89363 Manufacturers Plaza,410-0871,147.255.50.186,03/13/2018,2018-07-05 14:06:42,2018-11-25T00:59:02Z,1535964271,[{}],78.14,21,39.0730329,141.7138242,Yen,30271481645878,$6.35,quam sapien varius ut blandit non interdum in ante vestibulum ante ipsum primis
a-525,Teador,Eccersley,teccersleyek@wired.com,Male,618-660-1035,SE,2 Larry Street,415 07,216.194.232.43,02/16/2018,2018-07-24 01:44:52,2018-11-14T11:02:56Z,1514358330,"[{},{},{},{}]",159.74,11,57.7385277,12.0633439,Krona,3588175192046617,$1.52,convallis morbi odio odio elementum eu interdum eu tincidunt in leo maecenas pulvinar lobortis est phasellus sit amet erat
a-526,Fawne,Jouhning,fjouhningel@google.pl,Female,911-522-8587,RU,983 Hoard Street,628640,93.189.146.160,07/16/2018,2018-09-22 07:36:53,2018-06-18T16:43:15Z,1541457220,"[{},{}]",745.63,40,61.2844577,77.0904561,Ruble,3580461997405002,$9.59,et magnis dis parturient montes nascetur ridiculus mus vivamus vestibulum sagittis sapien cum sociis natoque penatibus et magnis dis
a-527,Rodolph,Varnam,rvarnamem@bravesites.com,Male,624-678-2513,LB,922 Mallory Alley,,35.95.134.59,04/09/2018,2018-03-16 21:27:38,2017-12-10T10:56:59Z,1539679215,"[{},{},{}]",299.27,43,34.2506515,36.0117322,Pound,4913658737134257,$6.92,aliquam convallis nunc proin at turpis a pede posuere nonummy integer non velit donec diam neque vestibulum
a-528,Emalia,Plenderleith,eplenderleithen@jalbum.net,Female,316-137-0911,DK,3 Columbus Place,1349,14.82.134.92,05/12/2018,2018-07-27 10:50:44,2018-11-06T09:38:30Z,1516918782,"[{},{}]",138.59,31,44.351935,-87.8445954,Krone,4936287542981406,$4.74,dui nec nisi volutpat eleifend donec ut dolor morbi vel lectus in quam fringilla
a-529,Ki,Rainon,krainoneo@w3.org,Female,147-191-9541,ID,81366 Kipling Alley,,214.178.105.18,10/14/2018,2018-12-04 02:45:14,2018-04-28T15:06:45Z,1526260743,"[{},{},{},{}]",44.42,34,-7.3897541,108.8640607,Rupiah,201771120409035,$2.11,tincidunt eget tempus vel pede morbi porttitor lorem id ligula suspendisse ornare consequat lectus in est risus auctor sed tristique
a-530,Man,Toe,mtoeep@twitpic.com,Male,542-246-5844,GR,0164 Riverside Terrace,,249.112.80.44,04/27/2018,2018-11-27 15:27:27,2018-08-21T00:40:51Z,1514461319,[{}],49.22,27,38.808984,22.6461855,Euro,201665339207729,$0.40,viverra eget congue eget semper rutrum nulla nunc purus phasellus in felis donec semper sapien a libero
a-531,Oby,Hoonahan,ohoonahaneq@time.com,Male,733-810-3591,CN,98 Service Terrace,,110.133.87.247,04/07/2018,2018-11-04 00:53:03,2018-10-30T16:10:33Z,1539626032,"[{},{},{}]",103.45,75,34.675197,103.498609,Yuan Renminbi,5602251550746564,$6.55,vivamus metus arcu adipiscing molestie hendrerit at vulputate vitae nisl aenean
a-532,Paulo,Champagne,pchampagneer@istockphoto.com,Male,614-413-8136,JP,7 Elgar Plaza,321-4342,110.202.185.68,11/25/2018,2018-04-02 15:22:22,2018-02-14T11:58:37Z,1526303518,"[{},{},{},{},{}]",293.79,9,36.4257359,139.9802454,Yen,5010126332467133,$2.88,mauris non ligula pellentesque ultrices phasellus id sapien in sapien iaculis congue vivamus metus arcu adipiscing molestie hendrerit at vulputate
a-533,Jamil,Horley,jhorleyes@gov.uk,Male,488-681-5667,CN,4620 Namekagon Center,,156.189.125.8,10/05/2018,2017-12-31 15:13:38,2018-03-11T22:19:54Z,1518963404,[{}],166.22,52,27.974248,120.632896,Yuan Renminbi,3542632311195126,$6.17,lorem ipsum dolor sit amet consectetuer adipiscing elit proin interdum
a-534,Dunn,St. Louis,dstlouiset@example.com,Male,335-718-9310,VN,48416 Artisan Pass,,246.26.72.226,07/06/2018,2018-11-10 05:44:13,2018-08-06T11:44:21Z,1521761935,"[{},{},{},{}]",583.18,19,21.2059357,104.0943247,Dong,374283861055127,$2.86,libero ut massa volutpat convallis morbi odio odio elementum eu interdum eu tincidunt in leo maecenas pulvinar lobortis
a-535,Salmon,Cottle,scottleeu@miitbeian.gov.cn,Male,170-694-0388,PH,705 Dunning Junction,5002,67.164.161.1,08/16/2018,2017-12-18 14:48:08,2018-05-24T09:53:00Z,1520626500,"[{},{}]",327.82,8,10.8220957,122.5296163,Peso,564182799479549513,$0.01,id lobortis convallis tortor risus dapibus augue vel accumsan tellus nisi eu orci mauris lacinia sapien quis libero
a-536,Niven,Nipper,nnipperev@springer.com,Male,946-572-4070,YE,88 Forest Dale Place,,53.78.196.216,04/27/2018,2017-12-27 17:53:58,2018-10-06T23:44:03Z,1516926977,"[{},{},{},{}]",130.91,65,16.73333,51.48333,Rial,6380639112893294,$1.05,eu magna vulputate luctus cum sociis natoque penatibus et magnis dis
a-537,Addy,Bracken,abrackenew@jalbum.net,Female,538-836-2564,ID,7 Crest Line Hill,,238.198.66.171,11/04/2018,2018-07-09 13:43:52,2017-12-18T16:19:19Z,1515411265,"[{},{},{},{},{}]",663.12,44,0.409905,109.9556406,Rupiah,3584989483383123,$5.04,mauris enim leo rhoncus sed vestibulum sit amet cursus id turpis integer
a-538,Benedikta,Fills,bfillsex@wsj.com,Female,820-555-6370,CN,78 Farragut Court,,144.90.36.108,08/18/2018,2018-03-24 03:12:58,2018-06-30T15:03:08Z,1528941411,"[{},{},{},{}]",422.7,15,41.217649,123.1966721,Yuan Renminbi,374622534646418,$0.03,sit amet erat nulla tempus vivamus in felis eu sapien cursus vestibulum proin eu mi nulla
a-539,Reynolds,Bacup,rbacupey@surveymonkey.com,Male,,US,,,42.17.60.33,08/04/2018,2018-06-27 06:40:10,2018-09-05T10:53:51Z,1529913939,,,,,,,,,
a-540,Banky,Jarratt,bjarrattez@imgur.com,Male,347-316-5211,CN,3019 Ramsey Junction,,170.24.243.56,04/08/2018,2018-10-14 15:59:56,2018-05-13T01:02:03Z,1520339674,"[{},{},{},{}]",227.5,13,19.318366,109.948275,Yuan Renminbi,5441162777891098,$3.77,amet eros suspendisse accumsan tortor quis turpis sed ante vivamus tortor duis mattis egestas metus aenean
a-541,Freeman,Spiaggia,fspiaggiaf0@etsy.com,Male,642-822-2798,PN,6 Harbort Drive,,70.19.189.120,09/27/2018,2018-03-30 07:57:13,2018-02-20T19:57:35Z,1544076905,"[{},{},{},{},{}]",730.34,55,-25.0662897,-130.1004636,Dollar,3566582583866030,$9.94,risus semper porta volutpat quam pede lobortis ligula sit amet eleifend pede libero quis orci nullam molestie nibh
a-542,Salem,Cullington,scullingtonf1@geocities.jp,Male,561-609-8277,CO,69981 Saint Paul Crossing,763029,118.218.215.33,05/08/2018,2018-06-16 23:15:37,2018-05-18T08:03:36Z,1520723411,"[{},{},{}]",151.75,65,3.9878168,-75.946324,Peso,4026438742995230,$1.57,eleifend pede libero quis orci nullam molestie nibh in lectus pellentesque at
a-543,Alix,Klossek,aklossekf2@topsy.com,Male,406-908-7843,PT,21 Karstens Way,4990-770,207.240.50.71,05/11/2018,2018-05-28 05:22:19,2018-10-01T08:50:03Z,1515929818,[{}],633.41,18,41.1296379,-8.5821823,Euro,67637928897549129,$8.39,tellus nisi eu orci mauris lacinia sapien quis libero nullam sit amet turpis elementum ligula vehicula consequat morbi
a-544,Helenelizabeth,Scadding,hscaddingf3@amazonaws.com,Female,282-596-6768,KG,5639 Sauthoff Avenue,,218.29.78.119,07/10/2018,2018-08-23 22:19:06,2018-02-18T09:39:33Z,1534122127,"[{},{},{},{}]",273.32,33,42.8862964,74.6722459,Som,3562377348680600,$8.12,eros suspendisse accumsan tortor quis turpis sed ante vivamus tortor duis mattis egestas metus aenean
a-545,Bessie,Lorkings,blorkingsf4@rediff.com,Female,514-308-0905,ID,7642 Morrow Crossing,,141.15.134.50,04/14/2018,2018-03-29 00:19:09,2018-07-13T04:01:31Z,1530478072,[{}],496.21,67,1.1704451,99.2037508,Rupiah,3584685270610476,$1.65,proin interdum mauris non ligula pellentesque ultrices phasellus id sapien in sapien iaculis congue vivamus metus arcu
a-546,Orson,Mugford,omugfordf5@posterous.com,Male,295-326-4898,MZ,59 Vidon Parkway,,141.85.13.3,09/22/2018,2018-03-16 04:08:34,2018-04-29T18:07:27Z,1516290535,"[{},{},{},{}]",342.92,62,-13.1340453,38.9981052,Metical,67598831863402579,$7.50,nulla integer pede justo lacinia eget tincidunt eget tempus vel
a-547,Barron,Maryott,bmaryottf6@mapquest.com,Male,122-661-0186,CN,1153 Warner Point,,102.20.145.209,05/23/2018,2018-01-30 02:05:45,2018-10-20T02:46:02Z,1541108756,"[{},{},{}]",288.87,2,33.570769,117.015187,Yuan Renminbi,3535111917701925,$8.99,turpis adipiscing lorem vitae mattis nibh ligula nec sem duis aliquam convallis nunc
a-548,Amble,Moffatt,amoffattf7@opera.com,Male,128-933-0691,FR,2827 Dahle Street,67039 CEDEX 2,200.113.78.159,02/06/2018,2018-10-18 05:20:59,2018-02-18T18:17:46Z,1540390330,"[{},{}]",429.49,70,48.5851876,7.7342943,Euro,201838706218732,$0.99,eu interdum eu tincidunt in leo maecenas pulvinar lobortis est phasellus sit
a-549,Max,Howorth,mhoworthf8@godaddy.com,Male,661-504-1382,CN,6077 Village Green Parkway,,113.71.183.250,03/13/2018,2018-07-29 16:17:53,2018-10-14T22:06:46Z,1523944640,[{}],163.17,29,28.6909216,113.5978392,Yuan Renminbi,3566261597494572,$5.59,libero rutrum ac lobortis vel dapibus at diam nam tristique
a-550,Wileen,Gillott,wgillottf9@time.com,Female,553-594-9054,CN,32233 Eliot Junction,,10.208.214.75,07/28/2018,2018-11-22 13:39:54,2018-09-27T23:44:02Z,1527458703,"[{},{}]",566.31,13,24.9480325,118.5389179,Yuan Renminbi,374283275080786,$3.27,turpis adipiscing lorem vitae mattis nibh ligula nec sem duis aliquam convallis nunc proin
a-551,Suellen,Besset,sbessetfa@constantcontact.com,Female,258-908-2605,PH,0153 Paget Pass,5009,27.59.254.225,04/27/2018,2018-04-04 22:11:50,2018-03-18T21:00:01Z,1527087770,[{}],593.3,21,11.0002604,122.740723,Peso,6304685957366860610,$6.03,scelerisque quam turpis adipiscing lorem vitae mattis nibh ligula nec
