id,first_name,last_name,email,gender,phone,country,address,postal_code,ip_address,date_format1,date_SQL_datetime,date_ISO8601_UTC,epoch,json_array,decimal_number,natural_number,latitude,longitude,currency,credict_card_number,price,description
a-1,Antonetta,Stachini,astachini0@joomla.org,Female,285-547-7432,KG,694 International Place,,52.84.76.200,02/23/2018,2018-08-08 06:41:57,2018-08-15T07:26:36Z,1533689528,"[{},{},{},{},{}]",445.68,8,42.4782102,78.3955986,Som,374283540778487,$4.65,integer a nibh in quis justo maecenas rhoncus aliquam lacus morbi
a-2,Adah,Lepick,alepick1@merriam-webster.com,Female,845-450-2685,BR,9236 Kedzie Drive,55550-000,161.5.60.55,02/01/2018,2018-01-23 06:48:42,2018-07-24T11:00:11Z,1537115781,"[{},{},{},{},{}]",609.25,12,-8.7393595,-35.4562795,Real,3542846619713998,$1.20,nec nisi vulputate nonummy maecenas tincidunt lacus at velit vivamus vel nulla
a-3,Lindsey,Tenby,ltenby2@youtube.com,Male,108-577-2816,DE,680 Kenwood Junction,10715,56.166.48.17,01/31/2018,2018-04-26 13:08:33,2018-11-22T16:47:30Z,1527265852,"[{},{},{},{}]",469.92,63,52.4837296,13.3304798,Euro,3558420496754367,$3.98,nisl nunc nisl duis bibendum felis sed interdum venenatis turpis enim blandit mi in porttitor pede justo eu
a-4,Millie,Dei,mdei3@quantcast.com,Female,939-911-8566,LK,9 2nd Alley,71326,214.62.149.141,03/11/2018,2018-03-13 05:24:02,2018-06-04T12:59:00Z,1536688210,"[{},{},{}]",645.16,66,9.7998986,80.1489188,Rupee,5100146216201730,$6.81,ultrices enim lorem ipsum dolor sit amet consectetuer adipiscing elit proin interdum mauris non ligula pellentesque ultrices
a-5,Bernarr,Blum,bblum4@google.de,Male,942-303-9740,CN,12 Nobel Street,,51.103.13.92,03/26/2018,2018-11-03 08:32:48,2018-03-01T09:46:28Z,1523496274,"[{},{},{}]",712.51,64,28.695534,116.664056,Yuan Renminbi,3548140785745958,$6.56,mus vivamus vestibulum sagittis sapien cum sociis natoque penatibus et magnis dis parturient montes nascetur ridiculus mus etiam vel
a-6,Carissa,Niccolls,cniccolls5@technorati.com,Female,,ID,,,249.218.240.101,01/28/2018,2018-05-20 19:11:39,2018-04-27T10:24:47Z,1539668510,,,,,,,,,
a-7,Asher,Trail,atrail6@newsvine.com,Male,774-689-6786,BY,0526 Bay Court,,74.200.113.58,07/23/2018,2018-09-20 15:48:36,2018-10-23T22:19:18Z,1519983806,"[{},{},{},{}]",509.37,44,53.4539951,26.4698363,Ruble,3586362353332513,$1.45,elit proin risus praesent lectus vestibulum quam sapien varius ut blandit non interdum in
a-8,Jakie,Marmon,jmarmon7@opera.com,Male,471-967-9377,BI,3330 Boyd Drive,,125.223.14.34,06/08/2018,2018-08-16 06:45:29,2018-06-08T13:00:48Z,1538298247,"[{},{}]",16.55,25,-3.428803,29.924903,Franc,3564248225988044,$8.83,accumsan tortor quis turpis sed ante vivamus tortor duis mattis egestas metus aenean
a-9,Gilberta,Bambrick,gbambrick8@latimes.com,Female,218-654-5761,MA,76775 Daystar Parkway,,167.41.178.212,02/01/2018,2018-03-03 16:01:28,2018-04-24T05:15:17Z,1542606851,"[{},{},{},{},{}]",760.38,17,33.8512937,-4.8676221,Dirham,677159472250136871,$1.70,vestibulum rutrum rutrum neque aenean auctor gravida sem praesent id massa id nisl venenatis lacinia aenean sit amet justo
a-10,Randy,Crummie,rcrummie9@wsj.com,Male,203-304-4068,MG,6626 Carpenter Lane,,188.142.84.78,07/26/2018,2018-09-16 04:45:57,2018-06-14T13:43:53Z,1531519456,"[{},{},{},{}]",745.71,47,-18.3181877,47.1118527,Ariary,6304540149745206724,$0.32,in quis justo maecenas rhoncus aliquam lacus morbi quis tortor id nulla ultrices aliquet maecenas leo odio condimentum id luctus
a-11,Lainey,Lunck,lluncka@ustream.tv,Female,993-594-1769,BR,51198 Rutledge Center,39830-000,118.211.196.74,02/17/2018,2018-10-02 01:28:37,2018-07-27T09:29:21Z,1534512662,"[{},{},{},{},{}]",753.63,20,-18.1880676,-41.8799408,Real,06045197863750079,$9.51,tempor turpis nec euismod scelerisque quam turpis adipiscing lorem vitae mattis nibh ligula nec
a-12,Stanislaw,Jewster,sjewsterb@aol.com,Male,731-505-9350,CN,7 Continental Parkway,,46.119.88.41,01/16/2018,2018-11-17 22:09:56,2018-05-16T17:56:50Z,1543334135,"[{},{},{},{},{}]",281.49,30,30.8861589,104.2532768,Yuan Renminbi,30245864518605,$1.18,interdum in ante vestibulum ante ipsum primis in faucibus orci luctus et ultrices posuere cubilia curae duis
a-13,Joye,Domoni,jdomonic@desdev.cn,Female,877-225-2129,ID,196 Farmco Point,,39.247.48.211,12/28/2017,2018-05-12 18:05:27,2018-04-27T02:05:37Z,1516092252,"[{},{},{},{},{}]",361.35,8,-2.4421225,115.188916,Rupiah,30469723405677,$4.65,vitae consectetuer eget rutrum at lorem integer tincidunt ante vel ipsum praesent blandit lacinia erat vestibulum
a-14,Grenville,Nickless,gnicklessd@163.com,Male,691-345-4060,CN,2 Springview Plaza,,253.81.246.77,02/11/2018,2018-01-18 21:28:59,2018-02-17T15:26:59Z,1530390026,"[{},{},{}]",469.09,68,27.522725,112.507849,Yuan Renminbi,374288622716602,$8.10,interdum venenatis turpis enim blandit mi in porttitor pede justo eu massa donec dapibus duis at
a-15,Giorgi,Busher,gbushere@opensource.org,Male,511-114-5538,CN,8753 Cherokee Center,,117.131.61.252,12/19/2017,2018-03-05 15:54:03,2018-05-06T15:15:52Z,1536065295,"[{},{}]",531.89,23,27.568278,117.562238,Yuan Renminbi,4026293370572029,$1.81,semper sapien a libero nam dui proin leo odio porttitor id consequat
a-16,Darrick,Collough,dcolloughf@nbcnews.com,Male,937-527-5564,RU,097 Birchwood Place,652930,51.220.146.81,12/27/2017,2017-12-28 22:09:44,2018-03-23T12:29:35Z,1526094096,"[{},{},{}]",574.93,62,53.109084,87.546299,Ruble,30140778022259,$8.74,nulla tellus in sagittis dui vel nisl duis ac nibh fusce lacus
a-17,Philly,Lamy,plamyg@ucsd.edu,Female,642-626-7679,BY,655 Stoughton Trail,,71.7.191.30,02/04/2018,2018-04-17 14:32:26,2018-02-16T20:36:27Z,1538316178,[{}],125.24,63,54.1190657,31.1014304,Ruble,374622666791941,$1.64,sem sed sagittis nam congue risus semper porta volutpat quam pede lobortis
a-18,Lynne,Bednall,lbednallh@godaddy.com,Female,839-491-3452,PT,876 Pearson Drive,2490-005,221.86.209.142,01/28/2018,2018-11-13 19:19:12,2018-05-22T09:11:39Z,1518453516,[{}],37.51,69,39.6445351,-8.5226286,Euro,372301361697743,$8.56,dolor sit amet consectetuer adipiscing elit proin interdum mauris non ligula pellentesque ultrices phasellus id sapien in sapien
a-19,Ferdinand,Goakes,fgoakesi@hostgator.com,Male,295-699-3829,SE,924 Debra Crossing,792 34,35.61.12.236,04/06/2018,2017-12-27 08:47:20,2018-10-20T17:58:58Z,1540016772,[{}],381.48,1,60.986717,14.5654425,Krona,4017951914498,$5.93,vitae quam suspendisse potenti nullam porttitor lacus at turpis donec posuere metus vitae
a-20,Ilsa,Pughsley,ipughsleyj@mlb.com,Female,488-183-7546,TZ,147 Arapahoe Park,,230.10.104.78,12/22/2017,2018-06-05 08:55:20,2018-02-08T11:23:52Z,1542097575,"[{},{},{}]",370.87,76,-7.6263425,39.065866,Shilling,3548459289265499,$8.28,tempus vivamus in felis eu sapien cursus vestibulum proin eu mi nulla
a-21,Tomasina,Spours,tspoursk@simplemachines.org,Female,639-309-2858,CN,265 Sachs Trail,,59.111.67.176,12/17/2017,2018-01-21 19:38:53,2018-09-15T00:39:09Z,1518088685,"[{},{},{},{}]",307.11,24,37.073667,80.188986,Yuan Renminbi,201644560118087,$1.84,non quam nec dui luctus rutrum nulla tellus in sagittis dui vel nisl duis ac nibh
a-22,Elvina,Wharlton,ewharltonl@zdnet.com,Female,799-896-5362,FR,25681 Sommers Center,13245 CEDEX 04,71.215.56.21,06/16/2018,2018-10-27 09:13:29,2018-10-11T18:12:37Z,1534359631,[{}],257.54,64,43.7441795,2.511999,Euro,3531575617460012,$8.14,elit proin interdum mauris non ligula pellentesque ultrices phasellus id sapien in sapien iaculis
a-23,Jamill,Kent,jkentm@mail.ru,Male,375-188-9847,CN,80 Dapin Point,,231.118.149.11,04/07/2018,2018-07-28 10:37:01,2018-09-22T10:16:46Z,1539309143,"[{},{},{},{}]",775.86,41,28.944692,119.314016,Yuan Renminbi,3549914631011032,$0.00,id justo sit amet sapien dignissim vestibulum vestibulum ante ipsum primis
a-24,Meier,Lowmass,mlowmassn@unc.edu,Male,814-296-7056,TH,6073 Lake View Parkway,80110,132.192.220.11,03/09/2018,2018-11-06 20:03:12,2018-01-29T15:28:39Z,1535569707,"[{},{},{},{}]",95.76,73,8.1642301,99.6756794,Baht,30013370882240,$2.70,massa volutpat convallis morbi odio odio elementum eu interdum eu
a-25,Leonid,Elkin,lelkino@omniture.com,Male,707-203-9991,SE,067 Twin Pines Circle,417 63,204.86.117.128,06/08/2018,2018-10-18 20:31:28,2018-11-17T22:57:46Z,1515029002,"[{},{},{}]",131.85,44,57.7039518,11.9212362,Krona,5602255777915100,$4.02,at lorem integer tincidunt ante vel ipsum praesent blandit lacinia erat vestibulum sed
a-26,Karon,Snoad,ksnoadp@deviantart.com,Female,585-238-1364,FR,161 Ronald Regan Alley,75808 CEDEX 17,42.157.164.86,10/23/2018,2018-08-30 10:41:33,2018-07-21T21:55:05Z,1516878964,"[{},{},{},{}]",749.32,9,43.4945737,5.8978018,Euro,3540777568720555,$7.34,tortor duis mattis egestas metus aenean fermentum donec ut mauris
a-27,John,Vaszoly,jvaszolyq@discovery.com,Male,233-362-1056,PL,5 Arapahoe Plaza,37-220,93.177.93.204,12/11/2017,2017-12-23 19:41:54,2018-03-27T17:37:10Z,1521371394,[{}],36.16,71,49.9833529,22.411607,Zloty,4844635625155382,$10.00,nec nisi volutpat eleifend donec ut dolor morbi vel lectus
a-28,Jereme,Eschalette,jeschaletter@vimeo.com,Male,,NG,,,186.151.128.224,04/20/2018,2017-12-26 01:05:07,2018-01-27T18:43:22Z,1533628928,,,,,,,,,
a-29,Thorpe,Jenteau,tjenteaus@sun.com,Male,766-581-5786,LV,1 Fair Oaks Crossing,,102.54.181.213,02/13/2018,2017-12-16 08:56:12,2017-12-19T22:13:12Z,1528659107,"[{},{},{},{}]",567.93,12,56.545959,27.7143199,Euro,30482969081078,$9.09,non lectus aliquam sit amet diam in magna bibendum imperdiet nullam orci pede venenatis non sodales sed tincidunt eu
a-30,Dionis,Brownstein,dbrownsteint@alibaba.com,Female,672-595-7124,CN,32 1st Lane,,31.104.161.153,08/27/2018,2018-09-27 08:53:51,2018-09-11T11:43:30Z,1513141905,"[{},{},{},{},{}]",724.2,22,29.181201,110.138102,Yuan Renminbi,5100135044616961,$4.30,quisque arcu libero rutrum ac lobortis vel dapibus at diam nam tristique tortor
a-31,Giacinta,Littlemore,glittlemoreu@soundcloud.com,Female,293-128-1057,RU,598 Mesta Plaza,613920,185.1.178.196,01/16/2018,2018-04-10 14:05:03,2018-03-18T23:16:11Z,1522736256,"[{},{},{},{},{}]",55.05,36,60.2496387,47.7885614,Ruble,3571580801769708,$6.22,sem duis aliquam convallis nunc proin at turpis a pede posuere nonummy integer non velit donec diam
a-32,Martelle,Kettlewell,mkettlewellv@narod.ru,Female,358-848-4969,IE,1734 Jenna Drive,A84,189.237.207.224,09/06/2018,2018-11-23 02:06:42,2018-02-17T04:46:35Z,1524774367,"[{},{},{},{}]",17.83,2,53.2724538,-6.1215213,Euro,3534719393623586,$5.02,integer tincidunt ante vel ipsum praesent blandit lacinia erat vestibulum sed
a-33,Byran,Slisby,bslisbyw@shop-pro.jp,Male,163-443-8800,AF,18846 Grayhawk Center,,22.75.253.238,07/21/2018,2018-07-30 00:26:41,2018-01-08T10:28:43Z,1521269167,"[{},{}]",629.21,69,33.83003,69.9192,Afghani,6370755449625373,$9.43,in lacus curabitur at ipsum ac tellus semper interdum mauris ullamcorper purus sit amet nulla quisque arcu libero
a-34,Tansy,Dunlap,tdunlapx@huffingtonpost.com,Female,971-696-2806,SE,07070 Truax Crossing,291 81,94.116.62.103,01/25/2018,2018-05-17 07:46:53,2018-08-21T18:04:26Z,1523214374,"[{},{},{}]",167.54,40,55.8634461,13.6916707,Krona,630419525366672264,$0.05,non mattis pulvinar nulla pede ullamcorper augue a suscipit nulla elit ac nulla sed vel enim sit amet nunc
a-35,Damiano,Joao,djoaoy@seesaa.net,Male,852-478-8481,BR,29446 Service Hill,57900-000,138.57.19.122,06/08/2018,2017-12-26 05:31:37,2018-04-22T06:51:30Z,1529846891,"[{},{},{},{},{}]",577.11,70,-9.0047392,-35.4124355,Real,3588822949645981,$2.06,sodales scelerisque mauris sit amet eros suspendisse accumsan tortor quis turpis sed ante vivamus tortor duis mattis egestas metus
a-36,Waylan,Stolberg,wstolbergz@geocities.jp,Male,636-310-4345,TH,5648 Oakridge Trail,45210,104.151.217.84,07/05/2018,2018-08-24 18:27:07,2018-10-21T08:53:43Z,1521830383,"[{},{},{},{},{}]",193.42,9,16.3413382,104.2279672,Baht,3584002868285705,$5.20,quisque porta volutpat erat quisque erat eros viverra eget congue eget semper rutrum nulla nunc purus phasellus in felis donec
a-37,Hermann,Mcsarry,hmcsarry10@arstechnica.com,Male,381-612-9172,SE,070 Westend Hill,511 81,19.131.59.152,09/25/2018,2018-02-01 02:44:59,2018-08-01T23:36:28Z,1523680805,"[{},{},{},{},{}]",343.06,76,57.4924284,12.6475194,Krona,3539606756441836,$4.08,amet justo morbi ut odio cras mi pede malesuada in imperdiet et commodo vulputate justo in blandit ultrices
a-38,Jilly,Marlow,jmarlow11@senate.gov,Female,643-298-2071,SE,14445 Meadow Ridge Pass,273 30,49.32.203.48,11/09/2018,2018-09-25 15:23:09,2018-09-28T05:46:43Z,1518643557,"[{},{},{}]",311.78,3,55.5449766,13.953453,Krona,4917701942807493,$7.19,dapibus dolor vel est donec odio justo sollicitudin ut suscipit a feugiat et eros vestibulum ac est lacinia nisi
a-39,Cobbie,Todd,ctodd12@youku.com,Male,767-547-6037,PE,98653 Haas Point,,60.171.239.44,10/15/2018,2018-02-20 03:01:42,2018-01-14T20:38:25Z,1517625762,"[{},{},{}]",57.55,16,-10.32553,-76.087997,Sol,201456926844672,$3.43,tincidunt eget tempus vel pede morbi porttitor lorem id ligula suspendisse ornare
a-40,Kally,Boddice,kboddice13@merriam-webster.com,Female,480-296-5108,KR,814 Lakewood Gardens Road,,228.54.201.16,12/14/2017,2018-04-25 02:29:37,2017-12-19T13:39:48Z,1512668887,"[{},{},{}]",372.24,12,37.7241501,126.2322458,Won,6378013729694574,$8.02,eget nunc donec quis orci eget orci vehicula condimentum curabitur in libero
a-41,Elli,Castelyn,ecastelyn14@sun.com,Female,754-342-8217,JP,3267 Dapin Trail,329-3155,156.190.9.92,01/11/2018,2018-11-14 10:48:04,2018-05-03T20:46:05Z,1543707221,"[{},{}]",420.62,57,36.9351637,139.9854087,Yen,3560059837243189,$9.93,odio donec vitae nisi nam ultrices libero non mattis pulvinar nulla pede ullamcorper augue a suscipit
a-42,Prentice,Fardoe,pfardoe15@tiny.cc,Male,647-834-9871,MR,63157 Northview Point,,131.5.151.41,10/22/2018,2018-02-20 11:31:58,2018-02-27T13:27:15Z,1520544356,"[{},{},{}]",598.39,57,15.1506088,-12.1804261,Ouguiya,3580303967380569,$4.58,in quam fringilla rhoncus mauris enim leo rhoncus sed vestibulum sit
a-43,Noah,Sidworth,nsidworth16@fda.gov,Male,646-353-2946,ML,0548 Messerschmidt Center,,82.7.54.89,05/04/2018,2018-06-12 17:04:56,2018-11-22T14:05:40Z,1538850264,"[{},{}]",599.22,45,16.2661738,-3.4044187,Franc,3558137136908647,$8.87,vulputate luctus cum sociis natoque penatibus et magnis dis parturient montes nascetur ridiculus mus vivamus vestibulum
a-44,Mattie,Yitzhok,myitzhok17@flavors.me,Male,996-598-8228,BY,21 Mitchell Way,,69.86.119.118,08/10/2018,2018-10-20 13:37:29,2018-05-14T09:50:25Z,1514989927,"[{},{},{},{},{}]",419.76,14,-43.3937074,147.2679116,Ruble,3565335981650238,$0.87,in hac habitasse platea dictumst maecenas ut massa quis augue luctus tincidunt nulla mollis molestie lorem quisque
a-45,Giralda,Saull,gsaull18@feedburner.com,Female,541-863-2721,PF,73593 Homewood Avenue,,239.55.33.153,07/16/2018,2018-01-11 05:01:35,2018-01-25T23:25:31Z,1543396240,"[{},{},{},{}]",233.67,33,-17.623,-149.6045718,Franc,5602217059987561,$0.94,pede justo eu massa donec dapibus duis at velit eu est congue elementum in hac habitasse
a-46,Isidro,Van Arsdale,ivanarsdale19@livejournal.com,Male,884-124-2112,PT,311 Sutteridge Place,4415-719,226.250.44.238,09/28/2018,2018-01-07 10:57:02,2018-11-28T21:05:04Z,1516049318,"[{},{}]",197.52,64,41.0394733,-8.5310302,Euro,4026166986439637,$6.40,vitae mattis nibh ligula nec sem duis aliquam convallis nunc proin at
a-47,Gilligan,Kliemchen,gkliemchen1a@globo.com,Female,663-764-5587,ML,23 Katie Terrace,,112.216.204.224,10/08/2018,2018-04-17 11:37:53,2018-07-26T17:21:49Z,1535830359,"[{},{},{},{}]",21.29,40,12.6392316,-8.0028892,Franc,4405766753086924,$7.88,luctus ultricies eu nibh quisque id justo sit amet sapien dignissim vestibulum vestibulum ante ipsum primis in faucibus orci luctus
a-48,Brew,McCaughran,bmccaughran1b@dagondesign.com,Male,755-799-0794,KZ,0 Rieder Street,,156.73.219.241,08/27/2018,2018-02-02 08:57:34,2018-08-04T22:15:43Z,1540484295,"[{},{}]",340.46,16,42.8911415,73.2320957,Tenge,4041591221815922,$5.77,sem mauris laoreet ut rhoncus aliquet pulvinar sed nisl nunc
a-49,Tristan,Eastcott,teastcott1c@smh.com.au,Male,501-367-6463,PH,25099 Hovde Road,6202,154.220.47.105,08/18/2018,2018-01-04 03:50:32,2018-04-18T06:52:59Z,1521343575,[{}],544.63,12,6.0455336,120.9985973,Peso,3580325833884789,$8.27,lectus pellentesque at nulla suspendisse potenti cras in purus eu magna vulputate luctus cum sociis natoque penatibus et
a-50,Claybourne,Rame,crame1d@ocn.ne.jp,Male,713-561-0034,CZ,3 Parkside Street,696 65,191.168.182.64,01/27/2018,2018-08-18 10:52:56,2018-08-02T22:26:32Z,1528749282,"[{},{},{},{},{}]",77.78,72,48.8818933,17.2802878,Koruna,4905893739543789,$7.20,proin interdum mauris non ligula pellentesque ultrices phasellus id sapien in
a-51,Aloysius,Cansfield,acansfield1e@exblog.jp,Male,893-508-4496,CN,493 Reindahl Avenue,,6.56.50.200,06/13/2018,2017-12-17 00:18:38,2018-05-24T16:22:04Z,1536413463,"[{},{}]",2.81,3,39.377733,99.819316,Yuan Renminbi,3569888336988626,$7.97,ut erat id mauris vulputate elementum nullam varius nulla facilisi cras non velit nec nisi
a-52,Adolphus,Pellingar,apellingar1f@blogs.com,Male,738-452-2030,KM,1 Iowa Avenue,,115.42.173.229,08/02/2018,2018-12-06 05:48:17,2017-12-21T13:50:53Z,1540082522,"[{},{},{},{}]",769.5,76,-12.31086,44.43702,Franc,5007660628352224,$8.96,pharetra magna vestibulum aliquet ultrices erat tortor sollicitudin mi sit
a-53,Lynnett,Kinchington,lkinchington1g@comsenz.com,Female,200-628-4738,GT,4889 Morrow Lane,13002,184.13.179.209,02/05/2018,2018-04-04 07:39:51,2018-05-31T05:13:14Z,1543678883,"[{},{},{}]",92.27,56,15.3549925,-91.458364,Quetzal,6706579200933129242,$6.09,consectetuer adipiscing elit proin risus praesent lectus vestibulum quam sapien varius ut blandit
a-54,Kinsley,Broadist,kbroadist1h@imageshack.us,Male,993-508-0525,DE,92 Carey Place,53129,210.209.7.228,12/25/2017,2018-11-17 21:31:51,2018-05-16T12:05:10Z,1517170830,[{}],701.67,12,50.7074591,7.1093481,Euro,4917999443752172,$4.14,non velit nec nisi vulputate nonummy maecenas tincidunt lacus at velit vivamus vel nulla eget eros elementum
a-55,Moss,Ondrusek,mondrusek1i@google.fr,Male,529-105-0132,RU,767 Anzinger Junction,601120,12.10.48.77,05/07/2018,2018-07-03 06:56:47,2018-11-27T17:27:15Z,1534749178,"[{},{},{}]",542.27,29,55.9180886,39.1784374,Ruble,3580754165422084,$1.78,volutpat dui maecenas tristique est et tempus semper est quam pharetra magna ac consequat metus sapien ut nunc
a-56,Lynsey,Tomasz,ltomasz1j@businesswire.com,Female,311-173-7006,PE,8182 Menomonie Junction,,70.72.31.239,08/24/2018,2018-05-26 06:57:55,2018-02-12T13:24:41Z,1538796099,[{}],55.2,4,-8.2141205,-78.9768999,Sol,3588182878406198,$1.70,vel ipsum praesent blandit lacinia erat vestibulum sed magna at nunc commodo placerat praesent
a-57,Wayne,Bentote,wbentote1k@thetimes.co.uk,Male,334-338-7542,CN,8 Manufacturers Parkway,,57.0.152.234,03/25/2018,2018-08-25 01:02:45,2018-04-11T20:53:47Z,1540616605,"[{},{},{},{}]",644.99,74,21.441808,110.778411,Yuan Renminbi,6304788082154135525,$1.43,mauris ullamcorper purus sit amet nulla quisque arcu libero rutrum ac lobortis vel
a-58,Alisun,McLoughlin,amcloughlin1l@rediff.com,Female,981-933-0993,CN,1192 Harbort Trail,,132.202.26.5,03/12/2018,2018-08-23 04:48:17,2018-05-23T20:51:14Z,1524613913,"[{},{}]",522.68,40,22.198745,113.543873,Yuan Renminbi,3555509751860241,$6.26,amet consectetuer adipiscing elit proin risus praesent lectus vestibulum quam sapien varius ut blandit non
a-59,Sadye,Thoma,sthoma1m@dropbox.com,Female,229-845-1158,US,7200 Mayer Hill,31605,100.34.28.28,06/25/2018,2018-09-29 03:45:32,2018-06-09T14:50:06Z,1534929284,"[{},{}]",581.15,57,30.9252192,-83.2291862,Dollar,5258733663165706,$7.66,quam pharetra magna ac consequat metus sapien ut nunc vestibulum ante ipsum
a-60,Hardy,Nix,hnix1n@constantcontact.com,Male,710-454-5544,PT,710 Division Terrace,9630-189,56.183.92.49,01/10/2018,2018-07-24 08:19:58,2018-06-11T10:28:58Z,1539146771,"[{},{},{}]",140.03,8,37.828804,-25.146173,Euro,4017952839470,$3.13,neque aenean auctor gravida sem praesent id massa id nisl venenatis lacinia aenean sit amet justo morbi ut odio cras
a-61,Rutter,Ciobotaru,rciobotaru1o@loc.gov,Male,531-952-2888,ID,295 Ridgeview Place,,247.21.139.239,11/18/2018,2018-11-17 15:13:58,2018-01-25T13:48:03Z,1534325086,"[{},{},{},{},{}]",225.4,19,-6.1418556,106.8281623,Rupiah,3541405937536382,$5.85,sit amet eros suspendisse accumsan tortor quis turpis sed ante vivamus tortor duis mattis egestas metus aenean fermentum
a-62,Dru,Oby,doby1p@army.mil,Male,700-331-5148,TH,5792 Lukken Place,13190,49.40.126.143,12/22/2017,2018-03-12 08:33:44,2018-10-09T10:11:07Z,1526139520,[{}],492.42,49,19.1527452,101.1539414,Baht,4905924367910477,$4.12,posuere nonummy integer non velit donec diam neque vestibulum eget vulputate ut ultrices vel augue vestibulum
a-63,Cherry,Scola,cscola1q@macromedia.com,Female,380-258-7655,HN,2 Hanson Hill,,198.212.99.214,03/18/2018,2018-09-29 15:56:44,2018-02-23T06:05:54Z,1521437481,"[{},{},{}]",135.14,22,14.299475,-88.1706047,Lempira,3540537020215846,$9.08,orci luctus et ultrices posuere cubilia curae duis faucibus accumsan odio curabitur convallis duis consequat
a-64,Killie,Bratch,kbratch1r@nymag.com,Male,340-981-6136,CN,35 Redwing Drive,,94.36.6.136,10/11/2018,2018-05-13 10:39:26,2018-02-14T21:50:54Z,1539012517,"[{},{},{},{}]",157.62,51,23.1833095,113.358579,Yuan Renminbi,5450751304325246,$5.00,vel lectus in quam fringilla rhoncus mauris enim leo rhoncus sed vestibulum sit amet
a-65,Jarad,Ganter,jganter1s@wikipedia.org,Male,,CN,,,187.53.20.68,01/27/2018,2018-12-01 13:56:42,2018-10-06T11:51:31Z,1541868876,,,,,,,,,
a-66,Dory,Sprowles,dsprowles1t@dailymail.co.uk,Male,999-666-5620,SE,25 Coleman Terrace,731 27,215.238.205.36,01/03/2018,2018-07-26 03:31:40,2017-12-12T18:41:11Z,1518980045,"[{},{}]",512.19,76,59.6027686,16.5250369,Krona,3586520851764194,$0.15,ornare consequat lectus in est risus auctor sed tristique in tempus sit amet sem fusce consequat nulla nisl nunc
a-67,Sonya,Crockley,scrockley1u@webeden.co.uk,Female,,RS,,,107.89.248.82,10/12/2018,2018-10-06 21:46:12,2018-04-20T09:01:13Z,1518541726,,,,,,,,,
a-68,Trixie,Prendeguest,tprendeguest1v@technorati.com,Female,751-434-2654,KR,87256 Blaine Way,,76.168.10.108,05/10/2018,2018-02-17 22:03:07,2018-10-18T02:47:21Z,1533461215,[{}],5.68,27,37.751853,128.8760574,Won,50187387025497984,$7.78,nibh fusce lacus purus aliquet at feugiat non pretium quis lectus suspendisse potenti in eleifend quam
a-69,Sonni,Eastwell,seastwell1w@yolasite.com,Female,963-130-8347,HR,634 Farwell Crossing,49218,174.25.77.117,07/08/2018,2018-05-05 22:14:45,2018-07-27T16:53:12Z,1543197864,"[{},{},{},{},{}]",585.79,56,46.1649072,15.7509093,Kuna,36793287919151,$1.78,odio cras mi pede malesuada in imperdiet et commodo vulputate justo in blandit
a-70,Chrisy,Marcombe,cmarcombe1x@google.co.uk,Male,,BO,,,184.71.208.63,12/08/2017,2018-12-05 21:30:16,2018-03-11T02:23:03Z,1513123029,,,,,,,,,
a-71,Bernie,Peagram,bpeagram1y@google.pl,Male,694-640-1370,CN,675 Mallard Way,,83.175.196.1,12/01/2018,2018-03-09 08:53:35,2018-05-08T00:09:25Z,1517451608,"[{},{},{},{}]",514.12,58,22.995838,113.933872,Yuan Renminbi,3532389748185871,$2.11,amet justo morbi ut odio cras mi pede malesuada in imperdiet et commodo vulputate justo in blandit ultrices enim
a-72,Clarice,Yurchishin,cyurchishin1z@hud.gov,Female,839-815-3372,RS,5634 Declaration Terrace,,12.52.33.7,10/11/2018,2018-08-08 16:46:11,2018-03-25T04:31:03Z,1533454165,"[{},{},{},{}]",18.04,64,43.7504777,19.7142007,Dinar,4917771694585977,$1.78,massa id lobortis convallis tortor risus dapibus augue vel accumsan tellus nisi eu orci
a-73,Rollie,Ricardot,rricardot20@geocities.jp,Male,318-666-9685,CN,2 Oxford Drive,,45.111.248.141,11/22/2018,2018-03-14 17:37:57,2017-12-23T02:43:56Z,1528278265,"[{},{},{},{}]",728.29,22,27.123078,104.727418,Yuan Renminbi,30515358754571,$3.56,quis orci nullam molestie nibh in lectus pellentesque at nulla suspendisse potenti cras in purus eu magna vulputate
a-74,Bernie,Gilleson,bgilleson21@howstuffworks.com,Female,870-964-6145,GR,7063 Oak Terrace,,42.58.255.162,08/04/2018,2018-08-28 07:33:28,2018-10-07T05:52:41Z,1520195505,"[{},{},{},{}]",601.49,62,38.5274257,22.2033742,Euro,5018995260386073,$8.10,integer a nibh in quis justo maecenas rhoncus aliquam lacus morbi quis tortor id nulla ultrices aliquet maecenas leo odio
a-75,Herold,Schachter,hschachter22@technorati.com,Male,119-910-2505,CN,8633 Daystar Park,,166.246.224.199,06/17/2018,2018-04-17 14:02:25,2018-08-24T20:31:35Z,1529751960,"[{},{},{}]",174.41,19,37.518314,111.144319,Yuan Renminbi,30156323884050,$7.71,rutrum neque aenean auctor gravida sem praesent id massa id nisl venenatis lacinia aenean sit amet
a-76,Mark,Pfleger,mpfleger23@instagram.com,Male,470-448-6725,FR,07962 Truax Drive,38219 CEDEX,1.94.236.119,03/28/2018,2018-09-21 08:18:31,2018-09-21T18:28:32Z,1524272818,"[{},{}]",482.83,48,46.3491846,-1.0849968,Euro,201404181163149,$8.96,sed sagittis nam congue risus semper porta volutpat quam pede lobortis ligula sit amet eleifend pede libero quis orci
a-77,Orelie,Curman,ocurman24@google.it,Female,333-868-7478,CN,3 Main Trail,,76.5.51.129,11/24/2018,2018-07-02 15:42:14,2018-06-30T06:54:14Z,1532597941,"[{},{},{}]",544.57,11,48.239431,129.3909831,Yuan Renminbi,3554918708267007,$4.69,vitae nisi nam ultrices libero non mattis pulvinar nulla pede ullamcorper augue a suscipit nulla elit ac nulla sed vel
a-78,Nedi,Hammel,nhammel25@deviantart.com,Female,884-162-5412,PL,28 Judy Crossing,73-140,11.236.27.37,09/28/2018,2018-10-03 02:57:31,2018-05-02T21:36:37Z,1513633487,"[{},{},{},{},{}]",714.38,55,53.43606,15.55039,Zloty,4017952935629753,$1.69,tortor duis mattis egestas metus aenean fermentum donec ut mauris eget massa tempor convallis nulla neque
a-79,Lea,Oddie,loddie26@goo.gl,Female,571-791-1091,VE,7 5th Terrace,,231.15.232.252,12/26/2017,2018-09-10 21:32:47,2018-04-12T07:23:34Z,1524378759,[{}],314.53,46,7.935298,-68.917999,Bolivar,5010123749864747,$1.60,elit proin risus praesent lectus vestibulum quam sapien varius ut blandit non interdum in
